Search_Query,Place_Name,Nickname,Date,Review_Content
3인칭관찰자시점,,보일러룸,3.9.월,한적해서 너무 좋았어요 인테리어 예뿌고 고양이 진짜 너무너무 순하고 귀엽고 부드럽고 영업부장이었네요 오션뷰 공간 너무 행복하고 좋은 시간이었습니다 추천해요!!
3인칭관찰자시점,,wjsldb,2.28.토,따뜻한 느낌의 인테리어와 넓은 마당 되게 특이하다고 느끼는 좌석 구조 느낌이 좋았던 카페  의류나 굿즈도 판매하고 있어서 구경할 수 있는 부분도 있어요 마스코트 고양이까지:)  커피도 맛있게 먹고 갑니다  주차는 신창포구에 하고 오셔야된데요
3인칭관찰자시점,,Harper 하퍼,1.5.월,제주구옥에서 신창리 바다를 바라볼 수 있어서 너무 좋네요➰ 커피랑 티도 맛있어요🤠
3인칭관찰자시점,,위드with세무회계,25.12.27.토,커피도 맛있고 별관에서 통창으로 바다가 보여요 풍차도 멋지고 마당이 따뜻한 느낌입니다
3인칭관찰자시점,,jhr99116,25.11.29.토,별관에 앉으면 통창으로 멋진뷰가 보이는데 좋았어요
3인칭관찰자시점,,호63,25.11.23.일,분위기가 좋고 한라봉에이드가 맛있습니다. 감사합니다~
3인칭관찰자시점,,syp****,25.11.20.목,인테리어가 특이해요 좁은공간임에도 간섭받는 느낌이 없어요. 카페에 사람이 있었는데도 독채에 있는듯한 느낌? 독특하고 커피도 무척 맛있었습니다 여유롭게 쉬고 싶으신분들 추천해요
3인칭관찰자시점,,candy432779,25.11.19.수,"제주 갈 때마다 찾아가는 카페 ""3인칭관찰자시점""  이번엔 혼자 방문했는데 신창포구에 주차하고 멋진 바다보면서 여유롭게 커피 한 잔하기 넘 좋았어요~~!!  색다른 인테리어에 대형카페와는 다른 조용함을 느끼고싶다면 고고  카페에서도 보이는 신창풍차해안도 가까워서 커피 한잔 후 서쪽해안도로 드라이브 시작하는 거 강추합니다"
3인칭관찰자시점,,명랑한모험가23,25.11.10.월,뷰가 너무 좋고 편안해요 귀여움 고양이도 있고 아이가 참 좋아했어요 좌석이 많지는 않아서 이번엔 조금 기다렸네요
묘한식당,,오름커뮤니케이션27,3.16.월,꾸덕꾸덕한 빠네가 먹고싶어서 다시 왔어요. 양 진짜 꽤 많아요 ㅎㅎ 끝까지 먹을 때까지 싹싹 맛있게 잘먹었습니다^^ 저녁엔 혼밥하시는분들로 태이블이 채워지네요. 모두 혼밥이라 저도 편하게 혼밥했어요
묘한식당,,두근두근 내 마음,3.15.일,"맛집이라고 해서 방문했는데 맛이 변한 것인지, 먼 길을 찾아갔는데 조금 실망스러웠습니다. 양도 적어서 식사 후에 간식을 먹으러 갔습니다. 파스타를 드시고 싶으신 현지인분들이 방문하는 식당인 것 같습니다."
묘한식당,,얄리85,3.8.일,11시 반쯤 방문하니 1번째! 주차할 공간도 넉넉하고 👍 흑돼지돔베카츠 넘 맛있어요 특히 안 느끼해서 좋아요 요즘 돈까스 먹으면 반 정도 먹으면 느끼해서 물리던데 같이 주는 감자가 또 글케 맛있음 소스가 완전 👍 야무지게 잘 먹고 갑니다 다음번엔 다른 메뉴도 먹어보고 싶어요 그리고 피클무 추가로 달라고 하니 2개 가져가도 된다고 하심 ㅋㅋㅋ 친절함이 👍
묘한식당,,bak****,2.27.금,묘한식당 돈까스 맛집으로 등록^^ 물론 감바스나 포모도로도 맛있어요. 하지만 저희는 돈까스를 애정합니다~ 돈까스 부드럽고 맛있어요. 짱!!!
묘한식당,,bak****,2.9.월,묘한식당 묘한 이름이지만 등심돈까스 정말 부드럽습니다. 주로 포장을 이용하는데 집에서 먹어도 맛있어요. 자주 먹는 사람만 아는 변하지 않는 음식맛이 아주 좋습니다~
묘한식당,,bak****,1.16.금,오늘도 포장 했습니다. 뽀모도로 파스타. 파스타 포장하면 맛없을까 걱정했는데 다행히 너무 맛있게 잘 먹었습니다~ 돈까스도 파스타도 다 맛있는 묘한식당~
묘한식당,,예쁜여왕64,1.10.토,지인소개로 방문했는데 대박~ 전 메뉴 먹었는데 하나하나 전부 맛나요 감바스 ~오 신세계의 맛 돈까스는 완전 육즙이 살아 있고 스테이크 보다 맛있어서 깜놀  가족과 함께 재 방문 예약요  사장님~~♡ 맛난 음식 감사합니다.
묘한식당,,왕소금2758,1.10.토,지인소개로 인생 파스타였다구 미리 예약하고 11시30분쯤 친구들과 메뉴별로 주문 크림빠네 감빠스 등 진짜 맛있는 이탈리안 레스토랑 이였습니디. 돈까스는 특히 안심이 입에 살살 녹아요 사장님 요리에 진심인듯 직원매우친절 합니다. 다음 여행 에도 재방문 ^^
묘한식당,,bak****,1.5.월,오늘도 포장 와이프가 너무 좋아하는 돈까스집. 퇴근길에 포장자주 하는데 항상 맛있어요. 돈가스 굳이고요. 사이로 나오는 감자와 양배추가 너무 좋아요. 오늘도 잘 먹었습니다.
묘한식당,,sky****,25.12.19.금,음식 깔끔하게 나오네요
사랑식당,장소 찾기 실패,해당 없음,해당 없음,해당 없음
패스더솔트,,lovingeverymoment,3.29.일,"집 근처에서 인생 브런치 카페입니다. 주말마다 방문하는 곳이에요. 사장님 부부가 운영하시는데, 문 열고 들어갈 때부터 정말 친절하게 맞아주셔서 기분이 너무 좋아지는 곳입니다. 특히 BLT 샌드위치는 꼭 드셔보세요. 재료가 정말 신선하고 사장님의 정성이 듬뿍 담긴 맛이에요. 맛도 서비스도 완벽한 제 최애 단골집입니다. 항상 기분 좋게 머물다 갑니다."
패스더솔트,,sou****,1.18.일,"Owners are lovely, food is so tasty. Everything in the menu is delicious so it is hard to pick just one. they have the best Chai's in Jeju-do."
패스더솔트,,joydreams,25.10.4.토,도민추천으로 간 인생맛집! 잊지않기위해 남기는 리뷰
패스더솔트,,Ria61,25.8.24.일,이번 제주 놀러오면서 최애 브런치 카페가 생겼어요. Best of best네요. 서울에서도 카페를 많이 댕기는 편인데 맛보지 못한 차이티에요. 더티 차이티 추천드려요.  브런치 카페에서 먹는 연어 베네딕트에서 보통 연어 퀄리티 기대는 안하는데 한입 먹어보고 깜짝 놀랐어요.👍🏻 인테리어가 예뻐서 들러보고 싶었던 곳인데 맛집이었어요... 다음에 제주 서쪽오면 무조건 들려야하는 브런치카페를 찾았네요. 사장님 잘 먹었습니다~👍🏻👍🏻
패스더솔트,,새벽곰,25.8.23.토,브런치하기 좋은 곳이에요. 분위기도 편하고 청결해서 자주 방문하게 되네요.
패스더솔트,,sub****,25.8.15.금,공간도 좋고 브런치 다 맛있어요 추천합니당
패스더솔트,,bom47,25.8.2.토,"좋은 곳은 또 가기! 일주일만에 또 왔어요^^ 남편은 ‘연어 에그 베네틱트‘ , 전 지난주와 마찬가지로 ’토마토 스프와 치즈 그릴 샌드위치‘ 음료는 아이스아메리카노와 진저라떼! 진저라떼 너무 맛있어요! 작년 가을엔 ’더티 차이라떼‘ 마셨는데 그것도 너무 맛있었어요! 음식과 음료 모두 맛있는 곳! 오늘도 다정한 ‘패스 더 솔트’ 🧂"
패스더솔트,,bom47,25.7.27.일,"맛있는 음식을 기분 좋게 내어주는 곳. 그 전에 멍멍이 물도 챙겨주시는 곳. 중형견 두마리도 맘 놓고 입장해, 보호자가 편히 음식을 음미할 수 있는 곳. 너무 소중해요 💕 감사히 잘 먹었어요!"
패스더솔트,,사시미27,25.4.7.월,< 내돈내산 리뷰 > 멋진 건물. 멋진 뷰. 훈남 사장님. 음식 또한 그에걸맞는 수준. 깊이있는 바삭한 빵과 풍미가득한 토마토수프는 도시에서도 느껴보지 못했던 맛!!  평소 한식 위주로만 좋아하는 사람으로 외국식 브런치 좋아하지않지만.. 이집 브런치는 깊이가 다르다;; 한식 잘 만들 자신없어서 브런치하신다는 사장님의 겸손함까지ㅎㅎㅎ 완벽한 집  건강한 재료에 배도 충분히 부르고 분위기와 음식퀄리티에 놀랏다가 합리적인 가격에 한번 더놀랐네요... bbbb
패스더솔트,,웡긔,25.3.2.일,"일단 음식이 너무 맛있고 쾌적한 공간이 매력적인 곳입니다. 무엇보다 반려동물 동반이 가능해서 중형견을 데리고 갔는데, 주문할때 이야기도 안했는데 강아지용 물그릇을 주시고 나중엔 강아지 먹을 음식도 챈겨주셨어요! 저희도 강아지도 다 만족한 좋은 가게였습니다..! (연어베이글 너무 맛남)"
하와,,제주채움남성의원,3.22.일,친구들과 안가본 바닥사 카페 이야기하다가 며칠만에 또 왔네요. 제주시에서 오는동안 드라이브도 되고 넓은 바다를 보면 편안한 쇼파에 몸을 뉘이면 맘이 한없이 평안해집니다. 이제 여름시즌되면 판포포구 난리 날건데... 비시즌일때 실컷 즐기고 갑니다.
하와,,제주채움남성의원,3.18.수,판포포구 위치가 갬성카페. 좋아요. 뷰도 좋고 오너부부 분들도 친절하고 협재쪽에서 쉬실때 한 번 들려보만한 카페입니다 커피 맛도 좋네요. 멀리 비양도가 이쁘게 보이네요.
하와,,소녀감성이라서,2.14.토,"제주여행 2일차 까페로 방문한 ""하와"" 판포포구 바다뷰가 넘 멋진곳 1층에서 주문하고 2층으로 올라가면 전면으로 제주 푸른 바다가 펼쳐져 넘 아름답고 휴양지 리조트 거실처럼 푹신하고 편안한 쇼파들이 아늑함까지 커피도 맛있었고 수제 마늘빵과의 조화 주문과 동시에 구워져 나온다 코코넛 크림라떼 맛도 굿!!! 다낭여행의 연장선인가? 잠시 착각을 불러일으키는... 대망의 망고 코코넛 스무디는 말모말모  무엇보다 넘 조용하고 편안하게 힐링했던 최고의 공간이 였다 바로 옆에 스테이 공간도 운영하신다는 담번에는 하루쉬어가는 일정으로 방문해보기로~~~~~~"
하와,,minsuseven,1.20.화,저희는 리뷰이벤트있을때만 리뷰를 쓰는데 처음으로 진심을 담아 쓴 리뷰는 하와가 처음인거같아요!! 그동안 영수증 받는다는거 계속 까먹어서 못썻다는🥺 서울가서도 자주 생각날거같아서 출발하는날엔 10개정도 동결건조시켜서가구시퍼옇ㅎㅎㅎ 날 좋은날엔 앞 바다 풍경도 너무 완벽하고 노래선곡도 완벽해 그날 하루를 완벽하게만들어주는 카페인거같아요 제주도 다시오면 바로 달려올테니 오래장사해주세요🤍🤍
하와,,찰스37,1.20.화,"바다가 보이는 통창에, 코지한 매장이 너무 편안했습니다. 사장님도 친절하시고, 음료도 맛있었어요 👍"
하와,,minsuseven,1.19.월,제주도 보름살이오자마자 간 카페인데 리뷰가 왜 없지 싶을정도로 너무 맛있고 퀄리티가 너무좋아요… 지금은 10일지났는데 그동안 6-7번은 사먹었어요 ㅋㅋㅋㅋ 남은 날도 그립지않게 더 먹을예정이에요🥺😻 진짜 한번먹으면 한번으로는 안끝나는맛이니까 다들 꼭드셔보세요ㅜㅜㅜㅠㅜ 특히 사장님과직원이 친절하세요😽😽😽 더 유명해졋으면좋겠어요… 사실 나만알고싶음ㅎ
하와,,boi****,25.12.4.목,베리그린스무디도 맛있는데 하와크림커피가 정말 특별하고 맛있어요. 은은하게 풍기는 코코넛향이랑 잘 어울려요👍🏻 2층 바다뷰는 말할것도 없고 소파가 아늑하고 폭신해서 푹 쉬다가는 느낌이에요 ㅎㅎ 사장님도 친절하시고 덕분에 힐링하고 갑니다~~
하와,,anna24,25.11.10.월,전부터 찜해둔곳 드디어 방문했어요~~분위기도 너무 좋고 커피도 맛있고 친절하세요 꼭 재방문 하고 싶네요
하와,,메기33,25.10.28.화,테이크 아웃해서 판포포구에 차 주차하고 마셨다. 카페에 들어가면 판포포구 재질 사장님이 맞이해주신다. 여름에는 아마 다이빙 많이 하실거 같다. 멋진 사장님만큼 커피도 멋있다. 맛있다. 가보자!!
하와,,세라퓨,25.8.29.금,판포포구에서 가장가까운 카페인데 여사장님 너무 예쁘시고 친절하셨어요~~ 커피도 맛있고 수제 마늘빵도 맛있었어요♡♡ 뷰 맛집♡♡
미레이나,,빠라삐리뽀로로,4.5.일,신창에 있는 카페찾다가 다녀왔습니다 3층 통창뷰가 참 좋았습니다 같이 온 지인들도 굉장히 좋아했어요 음료 디저트도 맛나게 먹었는데 저는 생바닐라라떼가 제일 좋았어요 꽃피는 계절에 가면 더 좋을 것 같아요
미레이나,,아꼬운여자,2.25.수,내용 없음
미레이나,,너무느린아줌마,25.12.31.수,뷰가 참 좋으네요 3층으로 되어있는데 2층과 3층에 테이블이 있습니다 2층은 8인석 테이블 하나만있고 3층이 포토존외에 좌석이 여유가 있어요 3층계단이 좀 높아서 내려올때 살짝 겁나긴하더라구여  친절하고 음료도 맛나요
미레이나,,anna24,25.11.9.일,전부터 찜해둔곳 드디어 방문했어요~~분위기도 너무 좋고 친절하세요 힐링 잘하고 왔어요 꼭 재방문 하고 싶네요
미레이나,,cho****,25.10.5.일,"바다뷰도 탁트여있고, 무엇보다 체스판이랑 이상한나라 앨리스 같은 컨셉이 독특하고 너무 예뻤어요! 포토스팟도 많아서 사진도 많이 건져가요ㅎㅎ 5-6월에 수국이 이쁘다해서 또 와보고싶네요^^ 무화과 요거트도 무화과가 2개나 들어가서 짱 맛있어요!"
미레이나,,요오나입니다,25.9.12.금,통창으로 보이는 뷰가~~ 너무 멋져요!! 맛있는 초코서비스도 감사합니다^^
미레이나,,모모627,25.7.19.토,너무너무 예쁘게 잘 꾸며진 카페에요 수국은 다 졌지만 카페 안에서도 힐링이됩니다
미레이나,,cookingholic,25.7.3.목,수국이 아름다운 카페라고 해서 방문했어요. 여기 수국은 파스텔톤의 수국이고 지금은 지는 중이긷하지만 아직은 인생사진 건질정도로 사진찍으면 수국이 멋지게 나와요. 내년에는 절정일때 꼭 와보고 싶어요. 수국으로 유명하지만 3층의 바다뷰도 끝내주고요 안의 내부인테리어도 사진 예쁘게 나올 수 있도록 멋지게 해두셨어요. 사장님도 친절하셔서 기분이 좋았답니다. 시그니처 당근쥬스도 신선하고 달달하니 당근 본연의 맛으로 역시 다들 추천하시는 이유가 있었네요. 근처 지나갈일 있으면 수국철이 아니라도 멍때리러 또는 인생사진 찍으로 오고 싶어요.
미레이나,,duddhr200435,25.7.1.화,이 카페는 정말 대놓고 사진 10000000장 찍고 가세요~ 아니면 후회 합니다~라고 뷰맛집입니다~♡♡♡ 카페입구부터 동화속들어가는 느낌~외부문열고 나가면 수국꽃이 사람얼굴만하게 함박피어있어요~당근주스랑 아메 시켜서 3층으로 올라가니 우아~~앙~~바다♡♡ 이게 제주바다구나 싶었어요~함께간 신랑 왜만해서 1시간 못버티는데 여기선 3시간이상 머물다 왔어요 눈과 마음이 힐링이였던 이곳하나로 이번 제주여행은 완전 만족합니다~사장님 !!꼭~오래오래 지켜주세요
미레이나,,동동맘19,25.6.27.금,수국이 너무 이쁜 카페에요 카페도 넘 이쁘게 꾸며놓으셨네요 사장님도 넘 친절하셔요
길동무,,gumson31,4.1.수,늘 한결같은 맛입니다.
길동무,,gumson31,3.18.수,맛있게 해주셔서 감사합니다.
길동무,,새로운출발과 도전,3.6.금,맛있어요
길동무,,gumson31,1.5.월,갈 때마다 시키는 두부 부침. 맛있게 잘 먹었습니다.
길동무,,물음표7899,25.12.28.일,제주올레 14-1을 다 걷고 늦은 점심 여유가 있었으면 샤브샤브도 괜찮았을텐데 다음 일정을 위해 간단히 소고기국밥으로 선택
길동무,,nsf****,25.12.28.일,저지오름 가는 길에 만난 식당 소고기국밥에 고사리가 들어 있어서 인상적 든든하게 한 끼 잘 먹었다
길동무,,gumson31,25.12.27.토,이름은 모르지만 겨울철에 직접 끓여주신 이 차맛이 아주 좋네요.
길동무,,첼양39,25.11.16.일,"올레길 걷고 저녁으로 백돼지샤브샤브 먹었습니다. 샤브 고기가 익숙한 소고기가 아닌 돼지고기였는데, 고기 질이 좋아서 그런지 전혀 거부감 없이 맛있었고 좋은 경험이었습니다. 또한 육수, 소스 모두 정성 가득한 집 요리처럼 맛있었고, 야채도 너무 신선해서 추가해서 먹었습니다! 사장님께서 먹는법 친절히 알려주시고, 중간중간 필요한것 없는지 확인하여 잘 챙주겨주셨습니다~ 올레길 걸으시는분들이나 이쪽 저지리 방문하시는분들께 매우 추천드립니다 :)"
길동무,,gumson31,25.10.26.일,늘 편안하게 먹는 곳이예요.
길동무,,gumson31,25.10.17.금,갈 때마다 두부 부침을 먹게 되네요. 정말 맛있어요.
옛날국수갤러리,,앙겔로스37,3.23.월,가격저렴하고 양이 진짜많아요 잔치국수 맛있어요 칼칼한 국물입니다
옛날국수갤러리,,jennyjlee,3.13.금,첫방문 양이 많아요 넘
옛날국수갤러리,,pspsjeju,2.1.일,"제주 서쪽 여행 중 제주시 한경면 고산로 731 옛날국수 갤러리 방문했어요. 매장 분위기도 깔끔하고 주문부터 음식 나오는 흐름이 편해서 여행 중 식사로 좋았습니다. 메뉴는 [먹은 메뉴1] + [먹은 메뉴2] 주문했는데, 특히 **[가장 맛있었던 메뉴]**는 간이 딱 맞고 마지막까지 느끼하거나 텁텁하지 않아서 만족! 국수집은 자칫 자극적일 수 있는데 여긴 담백하고 정갈한 느낌이라 남녀노소 다 좋아할 맛이에요. 제주 한경면 고산리 맛집 / 제주 서쪽 국수맛집으로 추천합니다. 다음에 오면 다른 메뉴도 먹어볼게요.  #옛날국수갤러리 #제주시한경면맛집 #고산로맛집 #고산리맛집 #제주서쪽맛집 #제주국수맛집 #고기국수 #멸치국수 #비빔국수 #수월봉근처맛집 #차귀도근처맛집"
옛날국수갤러리,,쩡이6757,1.14.수,양이 정말 많아요. 가성비 좋은게 장점입니다만 잔치국수가 그나마 먹을만해요. 비빔국수는 제취향은 아니에요. 잔치국수 육수는 일반적으로 생각하는 육수 색은 아니고 조금 맵고 톡톡거리는 느낌의 맛이라 매운거 못먹는 어린이가 먹기 힘들어요. 한번쯤은 .. 가볼만 해요. 참고로 개냥이가 있어요.
옛날국수갤러리,,fri****,1.8.목,옛날 국수 이 가격에 실화냐!!!맛나요
옛날국수갤러리,,que****,25.11.8.토,날은 썰렁했지만 더 추워짐 못먹을거같아 콩국수 시켰어요. 양을 반만 달랬지만 역시 그래도 많아요. 잔치국수도 맛있지만 콩국수도 맛있네요.  담 여행때도 또 들릴게요.
옛날국수갤러리,,har****,25.11.3.월,잘 먹었습니다
옛날국수갤러리,,짭짭리뷰어,25.11.2.일,"국수양이 기절입니다🐷쯔양도 왔다 간것 같더라고요. 양이 많아서 기본사이즈 시키면 될것같고, 맛도 맛있습니다. 요즘경기에 보기드문 가격이예요! 갠적으로 비빔국수는 조오금 제입맛에 달았고 잔치국수는 딱이었어요!재료 소진되면 빨리 문닫는것 같아요 전화하고 방문하셔요"
옛날국수갤러리,,뚠빵맘,25.10.20.월,쯔양이 방문해서 맛있게 먹던 모습을 보고 꼭 가봐야겠다는 생각을 했어요 생각했던 것 보다 양이 훨씬 많아요!!! 작게 룸도 있어서 아이랑 같이 앉아 먹기에 편했어요 전 잔치국수가 맛있었고 남편은 비빔이 더 맛있대요 하나하나 시켜서 나눠먹는 걸 추천해요
옛날국수갤러리,,0SmileMan0,25.10.19.일,"쯔양도 극찬한 이곳 리뷰 너무너무 쓰고싶어서 영수증까지 받아왔숨다!!  진짜 콩국수 이런맛 내는게 신기할정도로 미쳤어요 콩국수 너무 좋아하는데 여기는 우도 땅콩이 들어간건지 무가당 피넛버터의 그 꼬소함이 엄청나게 입안을 휘몰아 칩니다  여의도 진주집, 서울시청 진주회관 정도의 임팩트를 받아요 맛이 다른곳이랑 확실히 다르거덩여  면발의 탱탱함은 라텍스 수준 양은 말해뭐해요 육지대비 더 많아요  분위기는 진짜 먹는맛 더해주는 노포임닼ㅋㅋㅋㅋㅋㅋㅋㅋ  여기가서 콩국수 먹으려고 여름만을 기다렸다가 끝물에 겨우 먹고 갑니다  아 또먹고싶다  지난번 갔을때 일주일에 3번감 ㄷ ㄷ"
만덕본가,,qkr****,4.5.일,음식이깔끔하면서 갈치에신서함과간이잘베어들어 단백하니 맛이너무좋았어요
만덕본가,,0000006434,3.21.토,ㅇ
만덕본가,,MK Bayu,3.20.금,빈찬이 가짓수 많지 않지만 정갈하고 맛있고 고등어조림도 짜지 않으면서도 감칠맛 있고 깊어서 밥에 비벼먹으니 국물까지 남김없이 먹었어요. 조용하신 사장님이 친절하셔서 반찬 더 달라고 말씀드리기 불편하지 않았어요. 대단한 맛집은 아닐지 몰라도 한끼 맛있고 기분 좋게 먹었습니다.
만덕본가,,이재원8417,3.18.수,"배말랭 유튜브에서 보고 꼭 한 번 가봐야지 했다가 이번에 제주도 온 김에 왔는데 진짜 안왔으면 너무 후회할 뻔 했어요 ,,  일단 기본으로 나오는 밑반찬부터 정말 할머니댁에서 먹는 정겨운 느낌에 맛은 두 말하면 잔소리였음  갈치조림 나오자마자 냄새에 1차기절, 사장님께서 설명해주시면서 쉭쉭 숟가락으로 가시만 골라서 살을 발라주시는 센스에 2차기절, 밥에 슥 비벼서 입에 넣자마자 3차기절  소식해야지 하고 갔다가 갈치조림 맛보고 성게미역국도 시키고 공기밥 3공기 클리어 해버린 우리 ,,  진짜 꼭꼭 가보세요 먹느라 중간에 아차 사진하고 찍게 되는 맛입니다 이거만 먹으러 제주도 왕복 되겠냐고 하면 기꺼이요. 개추천 핵- 따-봉"
만덕본가,,운남동좀비,3.2.월,제주도 놀러 와서 갈치 먹으러 방문했는데 사장님도 친절하시고 맛있게 먹고 갑니다
만덕본가,,도도까미,1.14.수,갈치조림 맛이 있음 -!  ㅋㅋㅋ🤣🤣 근데 가장 기억에 남는건 반찬 ! 계속 리필해서 먹음요~~~ 비빔밥먹구 싶더라 고사리 반찬 겁내 맛이있음 ~~🩵 ㅋㅋㅋㅋㅋ🤣🤣🤣😘
만덕본가,,김루디00,1.12.월,대존맛. ㄹㅇ 제주도와서 안먹으면 후회할맛
만덕본가,,jm****,1.7.수,너무맛있게잘먹고갑니다~^^
만덕본가,,uznn,25.12.13.토,배말랭 유튜브 보고 방문한건데 너무너무 맛있게 먹었어요.. 저희밖에 없어서 그런건진 모르겠지만 뼈도 직접 발라주시고 국물과 함께 적셔서 입에도 넣어주셨습니다 ㅎㅎ 사장님 너무 따듯하시고 친절하세요 이제 제 맛집으로.. 제주도 갈 때 또 먹고싶어요 밑반찬들도 너무 맛있습니다🥹🩷
만덕본가,,김민정12,25.12.7.일,너무 맛있아요 사장님도 너무 친절하시고 대가족여행중인데 부모님들이 특히나 더 좋아하셨아요!!배부르게 먹고갑니다
산세라,,혼자서도잘먹어요,2.4.수,찻집 같지 않은 힙함 사장님 너무 친절하시구요 메뉴판에 있는 글들부터 너무 마음에 들었어요!! 다구들도 하나같이 다 너무 예쁘고 구워주신 가래떡도 맛있고... 제주에 좋은 카페가 워낙 많아서 커피를 많이 마시게되는데 건강 챙길 겸(?) 이런 티카페 오는거 넘 좋은 선택인거같아요
산세라,,la021130,1.30.금,11월에 지나가다 발견한 곳 차에 대해 모르지만 꼭 가고싶던 곳. 11월에는 방문 했을 때 자리없어 못가고 이번에 아이랑 같이 갔는데 넘 좋았어요. 이미지는 노키즈존인데 아니어서 너무 감사하고요 .  차마고도 아이꺼로 선택했는데 진짜 잘 마시고 즐겼어요 내일 또 가고싶다는 올해 9세가 된 아이 아이도 반하는 차의 맛
산세라,,kyn****,1.20.화,분위기도 너무 좋고 노래도 좋고 의자도 편안해요. 커피를 끊고 차를 마시기로 다짐해서 제주도 와서 차 마시며 힐링하네요. 사장님께서 친절하게 차 마시는 방법과 저에게 어울리는 차를 추천해주시고 가래떡이랑 귤도 서비스로 주셨어요. 제주도 힐링하러 오실 분은 산세라 꼭 들리셔서 차와 함께 기분전환하고 가세요^^
산세라,,쵸키77,1.1.목,"우연히 지나가다가 들렸는데 너무나도 만족스러웠습니다! 아기자기한 소품들이 많고 찻집의 미감이 너무 좋아서 사진 찍기도 너무 좋았고, 차 맛도 너무 좋았습니다. 차에 대해서 잘 모르는데 차 하나하나에 대한 설명을 너무 잘해주셔서 제가 원하는 맛의 차를 먹어볼수 있었습니다. 제주도 감성 찻집 원하시면 들리시는거 강력 추천해요!"
산세라,,샘물2275,25.10.26.일,차에 대한 새로운 지식을 얻고 다양한 차를 접할 수 있는 곳. 마음을 편안하게 해주는 사장님의 기운. 정성으로 구워주시는 가래떡과 찻잔이 비지 않게 채워주시는 다정한 손길.
