Search_Query,Place_Name,Nickname,Date,Review_Content
하이헬로블루 차귀도,,totoro41,4.19.일,내용 없음
하이헬로블루 차귀도,,day****,4.19.일,카페뷰도 너무 이쁘고 편안한 분위기에서 여행왔을때 방문하기 좋을거같아용
하이헬로블루 차귀도,,하하하하하45,4.19.일,우연히 들렀는데 주차하기도 편하고 차귀도가 아주 잘 보이고 아주 좋습니다 아메리칸도 플레인 요거트 주문해서 마셨는데 맛도 좋아요
하이헬로블루 차귀도,,지우 그랜맘,4.18.토,분위기좋고 커피맛좋구~~ 뷰가 넘 좋습니다
하이헬로블루 차귀도,,na0****,4.18.토,조아요
8월의중식,,봄날오후처럼,3.11.수,"제주 여행 마지막날 들린 중식당입니다, 잠봉고기 올린 짜장과 오므라이스, 짬뽕까지 먹었는데 요리가 아주 깔끔하고 맛있어요~ 사장님들도 친절하셔서 기분좋게 대화까지 나누며 서울로 올라갑니다! 건네주신 귤까지 너무 달달하네요! 덕분에 기분좋은 식사 한끼하구 가요~"
8월의중식,,돌핀남편,3.10.화,정말 맛있고 친절하시고 다시 오고싶은 곳
8월의중식,,woo****,3.2.월,제주까지 와서 먹은 짬뽕! 너무 맛있어서 후회 없어요 ㅎㅎ
8월의중식,,별빛눈물,2.4.수,싱게물공원 가는길 촐촐해진 시간 ~ 동네 맛집을 검색하던중 의아?하며 궁금해진곳이 있어서 들렀어요. 오 ~ 멀까 ? 했는데 두 사장님 친절하게 맞아주시네욯ㅎ 메뉴고민하다 삼선짬뽕과 흑돼지 치돈 시켰는데 전문점보다 더 잘난 비주얼에 한번.. 맛에 놀래며 그릇까지 긁어먹었어요ㅡ 이런저런 이야기도 나누고 특별한 소스 까지 내주시고 넘 맛있고 여행지에서 이런 특별한 곳을 맛보다니 입도 맘도 즐거웠어요. 또 들러도 반갑게 맞이해주실거 같아요 ㅎ
8월의중식,,밀바엔형주,25.12.26.금,바람이 너무 많이 불어서 숙소 근처에서 식사 해결하려고 찾아보다가 갔어요! 매장 식사는 안되는 상황이라 포장해서 먹었습니다 메뉴가 정말 다양해서 사장님께 추천받은 오므라이스로 먹었는데 소스도 맛있고 계란도 부드럽고 정말 맛있게 먹었습니다!👍  바람이 너무 많이 불고 뚜벅이 여행자라 돌아가는 길을 걱정하고 있었는데 사장님이 식사 하시다 말고 숙소까지 태워주셨어요 너무 감사합니다ㅠㅠ
8월의중식,,바람몰이16,25.12.15.월,맛있어요 탕수육소스도 맛있고 ㅎㅎ 사장님도 친절하세요
8월의중식,,쩝3715,25.11.16.일,너무맛있어서사진을못찍었어요ㅜㅜ돈가스소스가 진짜맛있어요!븡어빵도 서비스로주시고 사장님사모님이 정말친절하세요!!!
8월의중식,,유도현91,25.11.1.토,내용 없음
8월의중식,,안드레아제주,25.10.20.월,흑돼지고기짜장.탕수육시켜 먹었는데. 짜장도 정말맛있어요. 고기수육? 올려졌는데 넘 부드럽고 맛나네요. 간도 딱좋고 싹싹 긇어먹었네요. 찹쌀탕수육 겉바속촉의 정석. 귤을통째로 갈아 만들은소스가 풍미를 살려줘서 배부른데도 하나도 남길수가 없었구요. 완정 강추합니다. 다음엔 짬뽕도 먹으러와야겠어요. 숨은맛집을 찾았습니다~^^
8월의중식,,먹더리의맛집여행,25.10.9.목,ㅎㅎㅎㅎㅎ 특이해요~ 맛은 음 …저는 그냥 그랬어요^^;;
발리가든,,잉7466,2.18.수,고기 가격도 다른데에 비해 저렴한편이고 맛도 좋았어요 그리고 된장찌개가 너무 맛잇아요 꼭 시켜야해요 날 풀리면 또 오고싶어요!
발리가든,,축구93,2.4.수,"고기 질도 진짜 좋았고, 숯도 좋아서 맛있게 먹었습니다! 채소나 다른 것도 신선해서 체고였음다"
발리가든,,유승89,1.18.일,남자 3명이서 왔는데 네 좋아요 그냥 또 오고싶네요
발리가든,,물음표44,1.14.수,고기가 너무 신선하고 맛있었어요!!! 숙소 주변 식당이 여기밖에 없어서 간건데 너무 만족했습니다!! 최고!!
발리가든,,msj****,25.12.25.목,두번째 방문합니다! 식육 식당이라 고기 신선도가 너!!! 무 좋아요🖤 곁들임 고추 다대기는 신의 한수입니다... 여름에 오면 더 맛있겠지만 겨울 고추 다대기도 맛있어용 캠핑 분위기 좋아하시면 꼭 들려보세요 반려견 동반에 고기까지 맛있어서 너무 좋아하는 집입니다 😉 사장님 좋은 서비스까지 감사합니다!
발리가든,,으노기98,25.12.18.목,숙소에서 가까워서 우연히간 흑돼지고기집~~ 맛있어서 이틀내내 저녁은 여기픽~~~♡ 고기는 기본으로 너무맛있구요.계란찜도 너무 맛있고 공기밥은 윤기가 좔좔~~ 두번째갈땐.사장님이 알아봐주시고. 마시멜로 구우라고.따로 숮불까지.주시는센스~~ 마시멜로 별로 안좋아하는데...정말.노릇노릇구워서. 한입먹음.박수가.절로 나오는.. 고기도 진짜.너무 맛있어요~~넓은 마당은.반려견들 놀기도 좋을거같아요. 이틀내내.우리 저녁을 책임져준.발리가든..너무너무 추천합니다.
발리가든,,하령1,25.11.15.토,고기도 너무 너무 맛있고 (목살 진짜 촉촉쫄깃) 분위기도 좋고 무엇보다도 아이들이 너무 두시간 잘 뛰어놀아서 편안하게 식사할 수 있었어요. 잘 되서 자주 오래 오고 싶은 곳이에요. 이 넓은 곳에 호젓하게 두 가족만 먹어서 죄송할 지경이었어요. 사장님 너무 신경 많이 써 주셔서 좋았네요 !! 감사합니다.
발리가든,,피리81,25.11.9.일,"아이들이 더 즐거운 식사시간이었습니다🥰 엄청 친절하시고, 정원이 있어서 아이들이 열심히 뛰놀더라구요! 요새 이런 식당이 잘 없어서 유튜브만 보여주기 쉽상이었는데 정말 좋았습니다. 배드민턴치고,공놀이하고, 방방이타니 시간이 금방 갔어요~ 다음에 또 오겠습니다^^ 기분좋은 여행입니다. 감사합니다:)"
발리가든,,chl****,25.10.25.토,야외테이블이어서 마음에 쏙들고 고기도 너무 맛있고 직원분과 사장님도 다들 친절하셔서 넘 좋았습니다🫶🏻🫶🏻
발리가든,,Pineun,25.10.25.토,뷰도 너무 좋았고 고기도 너무 맛있게 잘 먹었습니다!
제주도란다,,Now just relax,23.12.18.월,뷰가좋은... 노을뷰가 나오는 제주도 신찰 풍차마을 카페 🏝☕️. 오늘 비록 구름이 많아서 아쉬었지만 날이 좋으면 노을을 보며 여기서 하루를 마무리 하고 싶다. 🍩🍰🍪🧁
제주도란다,,소라빛청아,23.12.6.수,"제주 도넛+오란다 = 도란다 도넛 모양의 오란다 의외로 맛있어서 한번 먹게 되면 멈출수가 없었어요!  넘나 귀여운 모양이라 사진찍고 맛 보는데 반틈이 순삭된거 있죠? ㅋㅋ 그리고 땅콩 오드리 라떼 부드럽고 고소해요. 땅콩 특유의 향이 진하게 나고 달달해서 오란다와 먹기 좋네요🎵  게다가 신창풍차해안도로 바로 앞이라서 뷰도 정말 좋아요. 오션뷰 보면서 힐링, 일몰때도 넘 이쁠 것 같아요. 미세먼지 심한 날에 와서 아쉬웠지만 다음에 날 좋을때 온다면 힐링하기 좋겠어요.  1,2층 모두 넓고 3층 루프탑도 있어서 친규, 가족들 다 같이 오기도 좋아요😘 아! 주차장도 넓오요~ 왔다가 앞에 신창풍차해안도로 산책까지 완전 딱!✨"
제주도란다,,lIIIllI,23.12.2.토,뷰가 끝내주는곳이에요 주차도 엄청 편하고 워낙 대형카페라 좋더라구요 디저트도 맛있어서 더욱 추천 ㅎㅎ
제주도란다,,LoLLoo,23.12.2.토,뷰가 미쳤어요 카페가 조용하고 넓고 편안해서 힐링하기 좋네요 시끄러운 육지에 있다 왔는데 찐으로 힐링되는 느낌 입니다 💕
제주도란다,,모콘,23.12.1.금,추천이요~ 인스타 사진 맛집 !! 제주 풍차 해안도로 오시면 꼭. 들르세요 뷰도 이쁘고 막찍어도 사진 잘나옴.
제주도란다,,전국돼지도,23.12.1.금,여기 커피도맛있구 마늘빵도 맛있네요!! 다른곳은 바게트느낌의 마늘빵인데 여긴 식빵느낌이라 안찔기고 좋아요~ 딸도 완젼 잘먹음^^  신창해안도로라 여행객 많은 데 잠깐 쉬다 금방 가시는듯 앞에 주차공터 넓고 카페엄청 넓구 뷰도 좋음 책읽고 노트북하기도 좋아요 스벅저리가라~~~  오란다 맛있어요 맨날 빵만먹다가 색다른거먹으니 애들 잘먹네요^^
제주도란다,,에스모멘트,23.11.28.화,오란다 너무 좋아하는데 제주도란다 취향 저격 ❤️  뷰가 미쳤다 정말 ❤️
제주도란다,,mb****,23.11.27.월,"딱딱하지 않은 오란다!!!!라서 먹기가 너무 좋아요^0^ 제주를 담은 도란다여서 색깔도, 맛도 다채로워요~ 평소에 오란다 안드시는 분들도 한 번 맛본다면, 제주 도란다에 빠지 실 거예요! 앉은 자리에서 4개나 까먹어버렸어요... 이제는 뻔한 도넛 말고, 제주 기념품으로 도란다 사가야겠어요^^"
제주도란다,,jun****,23.11.25.토,도너츠를 닮은 오란다 제주 특산물을 응용해 여러가지 종류의 오란다가 있어요 맛있네요 주차장도 넓고 싱계물공원에 갔다가 들르기에 좋을거 같아요 커피도 차도 맛있어요 👏
제주도란다,,lee****,23.11.25.토,맛 굿 커피 굿 오란다 굿 2층 소파 너무 굿
소요제주,,테카포카,25.10.9.목,한적한 곳에서 힐링했어요!!! 사장님께서 직접 빚으신 막걸리가 맛있어요~~
소요제주,,bae****,25.8.8.금,내용 없음
소요제주,,ful****,25.7.16.수,가게 분위기가 너무 좋고 사장님 음악 센스도 굿입니다. 특히 지인 분들의 라이브 공연은 매우 인상적이네요. 제주에서만 느낄수 있는 분위기. 편안한 곳
소요제주,,Qnqnwpffk,25.7.16.수,처음 가본 곳인데 사장님도 친절하시고 수제 막걸리도 너무 맛있습니다!! 연인이나 친구끼리 오기 좋은 것 같아요!
소요제주,,PhDRosa,25.7.13.일,"좋은 작가의 소설이나 에세이에 등장할 법한, 조용한 마을의 밤을 채워주는 멋진 공간이다. 아름다운 주인장이 직접 만든 수제 막걸리와 계절에 따라 달라지는 맛깔스런 안주들. 그에 더해 쥔장 취향인 듯한 적당히 우울한 음악까지. 이 곳에 발길이 닿은 여행자들은 복이 많은 듯."
소요제주,,보글보글66,25.5.22.목,"분위기 최고입니다~ 사장님도 친절하시고 안주도 맛있었네요 시중에 파는 막걸리랑 살짝 다른맛이길래 물어보니 사장님께서 직접 만드신거라해서 놀랬어요 분위기 좋고 맛있는 음식, 막걸리~ 좋은 사람들과 행복한 추억하나 만들고 갑니다."
소요제주,,짱구맘7168,25.5.4.일,친구들하고 제주도 여행갔다가 가게가 너무 예뻐서 들어갔는데 분위기도 좋았어요~~ 모듬전이랑 이양주 포장해서 숙소에서 먹었는데 아양주 첨 먹었봤는데 시중 막걸리랑은 차원이 틀려요~~입 안에 느껴지는 향이 너무 좋았습니다. 담엔 꼭 방문해서 예쁜가게에서 먹자고 친구랑 약속했네요~~~
소요제주,,Cloejin,25.2.15.토,수제막걸리는 많이 먹어봤지만 전통주조 막걸리는 처음인데 막걸리 정말 맛있네요. 사장님 지인분들 갑작스런 공연? 기타연주와 라이브 너무 좋았습니다.
소요제주,,지몬맨,25.2.13.목,"최근 소요제주를 방문하게 되었는데, 아늑하고 편안한 분위기 덕분에 친구들과의 모임이나 가족과의 식사에 최고의 장소라고 생각합니다. 특히 막걸리가 저의 기대를 뛰어넘었습니다. 부드러운 질감과 고소한 맛이 어우러져 한국계 위스키를 연상케하는 맛이에요. 걸죽하게 한모금 들어가면 세상 깜짝 놀래요. 안주도 사장님 솜씨가 좋아서 다 맛있고, 손에 조미료가 장착되어있어서 감칠 맛 좋아요 ! 친절한 서비스 또한 식사를 더욱 즐겁게 만들어 주었고, 한번 가고 계속 가고싶어지는 곳이에요.  승승장구하세요 !!"
소요제주,,재키럽0,25.2.12.수,서쪽에서 핫한 조수리에 힙한 막걸리집이라니 분위기있는곳에 안주도 맛있는데 수제막걸리까지👍🏾 안올이유 없고 다시 오고 싶게 하는 곳이에요 다음엔 혼자와서 혼술하기 좋은 바에서 한잔해야겠어요🥰
코삿호다,,vrl****,1.29.목,사장님께서 크나큰 친절을 베풀어주셔서 오늘 하루 기분 좋게 여행을 시작하게 되었어요. 근처 식당을 가려다가 문을 닫아 우연히 방문하게 된 카페인데 아기자기 귀여운 소품들도 너무 예쁘고 딸기라떼가 진짜 맛있었습니다🩷 앞에 판포포구에서 수영하고 오는 관광객들 때문인지 라면을 판매하시는데 바다를 보며 먹는 라면의 맛은 정말 꿀맛이었습니다! 겨울에 먹었는데두 맛있었어요 ㅎㅎ 다음에 제주에 오게 되거든 또 들릴게요! 감사합니다🤍
코삿호다,,꼴뚜기12,1.7.수,예쁜디저트와 맛난 커피 거기에 미친 뷰까지!!! ㅎㅎㅎ 날이 안좋았는데도 앞에 바로 바다가 있어서 바다구경하면서 힐링했어요~ ㅎㅎㅎ 일단 인테리어가 너무너무 예뻐요. 말차카스테라랑 과일도 주셨는데 넘 맛있게 잘 먹었습니댱! 예쁜 추억 만들고 갑니당❤️❤️🩷🩷
코삿호다,,red1235,25.10.10.금,사장님 친절하시고 커피도 좋아요. 가족 여행하다가 그냥 들렀는데 커피마시면서 뷰를 보니 너무 좋네요.
코삿호다,,Buzzinga25,25.8.26.화,사장님 너무 친절하셔서 판포포구 올때마다 들러요. 코코넛 스무디 진짜 미친존맛탱이에요. 베트남 콩카페보다 더 맛나요. !! 또 올게욧
코삿호다,,네잎 클로버 사랑,25.7.28.월,"한림읍 판포포구 바로 앞에 위치한 아담하고 귀여운 카페. 이름도 앙증맞게 ""코삿 호다"" 아이들 판포 포구에서 물놀이 하는 동안 우리 부부는 애들 보면서 카페에 앉아 김밥과 컵빙수로 배고픔과 더위를 날렸습니다ㆍ 보기엔 가격대비 양이 너무 적나 싶었는데 생각보다 양도 많고 이것저것 많이 들었어요ㆍ 컵빙수 강추요ㆍ 맛도 있어요ㆍ 땡볕에 돌아다니다 와서 이거 한그릇 먹으니 3분의 2정도 먹으니 좀 춥다 할 정도? 애들한테는 미안하지만 ㅎㅎ 정말 맛있게 잘 먹었어요ㆍ 또 바깥뷰도 너무 예뻐요ㆍ"
코삿호다,,운복15,25.7.11.금,여기 수박주스 최고에요!! 엄청 당도 높은 수박 ㅠㅠ♥️☺️ 위에 수박 올려주시는 센스💗
코삿호다,,star1471,25.6.30.월,판포포구 물놀이하고 먹기 딱이에요 ㅎㅎ 맛있어요
코삿호다,,goodwear,24.9.19.목,비싼 ㅎㅎ
코삿호다,,ㅇ7967,24.8.27.화,마셔본 수박주스 중 여기가 제일 맛있었어요☺️ 사장님도 너무 친절하세요 매년 여름 오고 싶은 곳이에요~
코삿호다,,sun****,24.6.3.월,굿 👍
카페리나,,travellers12,3.23.월,커피 향이 정말 신선
카페리나,,수박박박수,2.10.화,따뜻한 복숭아차 추천해요🍑 걷다 우연히 발견한 카페였는데 고양이 소품들이 가득한 사랑스러운 공간이었어요~!
카페리나,,lulu3,1.31.토,"스크런치 선물할 친구에게 잘어울릴것같아요!! 청포도에이드 진짜 맛있어요!! 적당히 달달하고 깔끔, 청량해요. 고급진맛. 살짝씩 과육이 씹혀서 좋아요"
카페리나,,만지48,1.28.수,아내가 근처 병원에 가있는 동안 있을 카페를 찾다가 발견한 곳입니다. 카페 밖에서 창틀 너머로 보인 고양이를 기대하며 들어 갔지만 아쉽게도 고양이는 사장님과의 독대중이었던 것 같았습니다.  카페 내부에 고양이 모양의 장식이 많이 보이는 걸 보니 사장님께서 확신의 애묘인이신 것 같습니다.  저 혼자 왔음에도 난로를 두 개나 켜주셔서 몸이 데워지기 전에 마음이 먼저 데워졌습니다. 커피는 따뜻한 아메리카노를 주문했습니다. 향이 좋고 너티한스타일을 좋아하는 제게 잘맞는 맛이었고 머그잔 까득 담아주셔서 아내를 기다리는 시간이 길어져도 부담없었을 것 같았습니다.  조용하고 차분히 시간이 흐르는 곳에 있어서인지 노트에 끄적이는 글도 잘 이어졌습니다. 더 있고 싶었지만 생각보다 일찍 진료가 끝나 조금 아쉬웠습니다.
카페리나,,lulu3,25.11.15.토,두달후작성하는리뷰!! 이곳 카페의 파운드케잌과 고양이 쿠키를 좋아한다. 얼그레이파운드 보다는 녹차파운드케잌이 갓구웠는지 엄청 맛있었다! 저 차이름이 뭐더라? 개복숭아 내기준 조금 달았지만 달면서 뜨거운게 필요하면 매력있다 특히 겨울에. 가끔 생각날때 찾아가는 카페 매장도 예쁘고 힐링된다
카페리나,,무저,25.10.29.수,귀여운 고양이 컨셉의 소품샵+카페 🐈☕️ 아기자기하고 분위기 차분해서 너무 좋아요 오랜만에 들렸는데 바빠서 테이크아웃만 했네요 잠깐 머물렀지만 늘 들리면 기분좋은 곳☘️ 커피 짱 맛있어요!
카페리나,,레나레나시레나,25.10.8.수,고양이 그림 그려진 입간판 보고 홀린듯 들어갔는데 귀여운 소품 판매하는 아늑한 카페였어요! 이번에는 소품만 구매하고 나왔는데 다음에는 카페메뉴도 즐겨보겠습니다 ♥ 귀여운 소품 많고요. 사장님이 아주 친절하세요!
카페리나,,무저,25.9.10.수,내돈내산 ✌🏻번째 방문!! 고산에 오면 꼭 들리는 카페입니다 🧡 고양이 좋아하시면 더 추천해요🐈🐈‍⬛ 아기자기하게 소품들이 있어서 구경하기 좋고 자리마다 고양이 책들이 올려져있어요ㅋㅋㅋ😻  무엇보다!! 커피가 진하고 맛있어요 ☕️ 수제브라우니도 짱맛있음...🍪🍪 음악도 조용해서 책 읽거나 작업하기 좋고 기분 좋은 재즈 나와서 아늑하고 편하게 쉬기 좋아요 저절로 평화로워짐🌳😌 사장님도 친절하시고 자주 오겠습니다💕
카페리나,,김짱님,25.7.17.목,더위를 피해 우연히 찾은 카페입니다. 조용하고 아늑한 분위기에요💛 고양이들은 나오지 않아서 만질수는 없었고 창문 너머로 구경했는데 힐링이네용ㅎ ㅎ 커피도 달달 시원하고 맛있었습니다🥰
카페리나,,앗끄시,24.11.4.월,"카페 분위기도 지브리 감성 + 아기자기한 우드톤의 인테리어라 정말 예쁘고, 디저트까지 맛있는 곳이에요 💕 🥹 저는 레몬이랑 얼그레이 파운드케이크 포장해왔는데 글레이즈가 녹을까봐 따로 챙겨주시기까지... ♡ 사장님께서 넘 친절하시구 카페가 주는 특유의 분위기와 감성이 넘나 사랑스러운 곳 😘 !!! 고즈넉하게 시간 보내시기에도 좋고, 테이크아웃해서 디저트랑 음료만 맛봐도 넘 맛있어요♡ 데이트 장소, 모임 장소로도 추천추천 !!! 전 다음에 제주도 가게되면 또 방문할거에요 !!"
