Search_Query,Place_Name,Nickname,Date,Review_Content
한양동식당,,모모 ahah,3.18.수,한식뷔페 맛집 .. 제주에 이런곳이 있는줄도 몰랐던 저에게 신세계 맛집 이네요 . 이연복세프님이 극찬 한곳이라는데 역시 대박 입니다 .. 2시까지 한다고 하니 제주여행 가시면 꼭 한번 들려보시기를 추천 드리네요
한양동식당,,민이근이엄마,3.17.화,음식이 깔끔하고 맛있어요
한양동식당,,드가14,3.17.화,지나가다 들렀는데 맛있게 잘 먹었습니다 아강발 같은 거 나오는 한식뷔페는 첨이네유 번창하셔요
한양동식당,,drchuuk,3.16.월,올레길 13코스에서 약간 떨어졌지만 점심 먹기 위해 찾은 유명한 뷔페식당. 단체 손님들이 엄청 많다. 아마 저가여행 시 필수 방문 식당이 아닐까. 음식은 짜지도 않고 맛있고 칼치 튀김도 돼지고기 수육도 상치도 맛있다. 가성비도 높다.
한양동식당,,전과대,3.13.금,저지리가면 꼭 가세요 이 날은 쑥넣은 몸국이 너무 맛있었어요 11시 오픈런할때 가시면 좋습니다
한양동식당,,soheun,2.18.수,엄지척.. 가성비 최강..
뚱보아저씨,,Happy써니,4.19.일,너를 우째잊니..
뚱보아저씨,,Happy써니,4.10.금,가성비 미쳤네요 .. 생선 간 진짜 쩔어요
뚱보아저씨,,kyj****,4.1.수,기름에 튀겨서 인지 몰라도 겉바속초 입니다. 너무너무 맛있어서 계속 손이 가요. 고등어조림도 비리지 않고 너무너무 맛있어요.~👍🏻
뚱보아저씨,,언젠가요리왕,3.31.화,"*조림 2인 45,000원 *구이 정식 12,000원 일정이 변동되면서 우연히 방문하게 된건데 덕분에 제주 맛집을 한곳 더 알게 됐네요.  갈치구이는 튀기듯 구워졌는데 겉은 바삭 속은 부드럽고 간도 밥과 먹기 좋았어요. 정식에는 미니 사이즈 고등어조림이 함께 나왔습니다. 갈치조림은 양념이 맛있어서 밥 두 공기 가능한 맛이습니다."
뚱보아저씨,,J파람,3.23.월,맛있어요
뚱보아저씨,,Chloe YJ,3.18.수,튀긴갈치가 맛있어서 제주 올때마다 2번씩은 오는 식당인데 갈치크기가 랜덤이라--; 오늘은 좀 짜기도하구요. 밑반찬도 맛있고 해서 또 올거 같긴해요~
뚱보아저씨,,Cobaltb,3.14.토,이른 저녁 먹으러 갔는데 웨이팅 없어 너무 좋았어요.^^
뚱보아저씨,,ksu****,3.14.토,맛있어요
뚱보아저씨,,한글y,3.10.화,여기 꼭 오셔야해요...꼭이요..
뚱보아저씨,,하느리8230,3.8.일,ㅇㅇ
울트라마린 제주,,오갱쓰,4.12.일,비오는날 운치있어요
울트라마린 제주,,AZOMNI,3.3.화,제주 올때마다 들르게되는 카페에요. 전망이 죽여서 힐링되는 곳이에요. 강추하니깐 한번 와보세요. 현무암과 파도 보는 맛이 있어요.
울트라마린 제주,,bungle7,2.28.토,제주에 (제가) 첫 발 딛기 이전부터 핫플이었던 이 곳이 어느덧 장수 카페가 되었네요. 3번 정도 방문했던 듯한데 매번 흐릴 때마다 왔다가 때마침 맑은 날 오니까 포토존의 위엄이 되살아난 것 같습니다. 구관이 명관?😊. 여기 커피도 맛있습니다. 뷰와는 별도로 커피 즐기시는 분들도 좋아할 수 있겠어요.
울트라마린 제주,,cho****,2.20.금,여긴 너무~뷰가 좋아요. 앞에 바다도 볼 수 있는 여기로 와보세요.
울트라마린 제주,,또이7670,1.13.화,뷰가 너무 멋집니다. 탁 트인 바다뷰에 커피 한잔.. 힐링이네요 ㅎ
울트라마린 제주,,카미노드제주,25.12.27.토,"일주서로에 접해 있어 환상적인 바다뷰를 실내에서 감상할 수 있는 카페입니다. 인테리어 스케일이 남다른 곳에서 향긋한 커피도 마시고 연인과 가족과 힐링하기 좋은 곳, 꼭 방문해보세요.😍"
울트라마린 제주,,뿌아85,25.12.27.토,조아요
울트라마린 제주,,김마리0,25.12.23.화,쑥 케이크 맛있어요
울트라마린 제주,,카미노드제주,25.12.7.일,일주서로에 접해서 접근성도 뛰어나고 바닷가 바로 옆이라 그야말로 바다멍 하기 딱 좋은곳. 붉게 타오르는 석양은 덤입니다. 제주서쪽여행 필수코스 추천해요👍
울트라마린 제주,,gracejedi,25.12.5.금,작성중
마루나키친,,서현4470,4.22.수,게살도 꽉 차있고 하나도 비리지 않았어요 레몬밥이 완전 킥이었습니다 외관도 예쁘고 음식도 정갈해요~
마루나키친,,길쇼니치,4.20.월,"아이와 같이 방문했는데 직원분이 친절하게 응대 해주셔서 기분이 너무 좋았고, 음식도 잘 설명해주시고 너무 맛있었습니다!!"
마루나키친,,냐하하1162,4.20.월,제주도 갈때마다 꼭 갑니다 진짜강추요
마루나키친,,VIP 벤츠 스프린터 리무진,4.20.월,"우연히 지나가다 급하게 들른 곳이었는데, 기대 이상으로 만족스러운 식사였습니다. 음식은 하나같이 맛있었고 특히 게장은 하루 한정 수량이라고 하셨는데, 운 좋게 맛볼 수 있어 더욱 특별했습니다. 신선하고 깊은 맛이 정말 인상적이었습니다. 무엇보다 직원분들께서 매우 친절하게 응대해 주셔서 식사 내내 기분 좋게 머물 수 있었습니다. 우연히 방문했지만 다시 찾고 싶은 곳이며, 자신 있게 추천드립니다."
마루나키친,,dhn,4.20.월,제주도여행와서 우연히 들렀는데 아기도 잘먹고 맛있습니다.
마루나키친,,럭키하은,4.20.월,음식도 너무 맛있고 사장님도 너무너무너무 친절하시고 만족도 최고입니닷! 메뉴 설명도 잘해주시고 그만큼 더 맛있게 행복하게 식사했어여ㅠ감동서비스🥹👍 제주 살면 자주 가고싶네용 여행이라 아숩ㅠ 완전 추천하는 맛집입니당~~🍀
마루나키친,,베이지혜,4.19.일,오 너무 신선하고 맛있어요!! 돈까스랑 해물장을 같이 먹는 재미도 있고 밑반찬도 다 깔끔. 직원분도 너무 친절하셔서 기분좋게먹었어요. 또올게요!
마루나키친,,hs9****,4.19.일,직원분이 너무친절하고 너무맛있어요!!!! 분위기 정말좋고 예뻐요ㅎㅎ 제주도 판포포구쪽 오면 또 먹으러갈것 같아요ㅎㅎ
마루나키친,,eggseven,4.19.일,지나가며 꼭 가고 싶은곳이었는데 모든 음식이 너무 맛있고 분위기도 좋네요!! 그리고 진원분이 너무 친절해 감동받고 갑니다!! 다음에 꼭 또 다시 오고 싶어요!!^^
마루나키친,,여우별62,4.19.일,진짜 개맛있어요ㅠㅠ 허겁지겁 먹느라 사진도 없지만 해물모둠장 진짜 반드시 주문하세요! 여수에서 먹은 모든 게장집을 이겼습니다.. 가격도 혜자 그 자체👍🏻 제주도 올때마다 방문하겠습니당
제주할망밥상 차귀도점,,so so D,4.22.수,차귀도 뷰를 바라보며 먹는 생선구이 한상! 생선구이가 나오는 할망그날정식으로 먹었어요 생선이 간도 좋고 맛있어요 ㅅㅅ 다음엔 갈치조림 먹어 봐야겠어요 기대 친귀도 맛집 추천요!!
제주할망밥상 차귀도점,,Black yong,4.22.수,차귀도 맛집 입니다. 차귀도 들어가기전 밥먹고 들어가기 딱 좋은곳 제주생선구이 정말 맛있고 많이나오네요!!! 추천 입니다!
제주할망밥상 차귀도점,,zlzl키키,4.22.수,뷰가 너무 좋아요!!! 돌고래 보면서 밥먹을수 있어요 차귀도맛집이네요 제주생선구이도 맛볼 수있어서 아이들과도 방문하기 좋아요
제주할망밥상 차귀도점,,예린갓,4.22.수,"진짜 뷰도 너무 훌륭하고, 너무 이쁜 바다를 보면서 먹는 할망 정식은 체고에요!! 생선도 너무 맛있고 좋네요. 가파도 청보리 막걸리도 있어서 넘 좋네요.  <차귀도맛집> , 제주 생선구이 완전 맛있어요!"
제주할망밥상 차귀도점,,피자조아제주,4.21.화,푸짐하고 매장넓고 단체모임하기 좋아요
제주할망밥상 차귀도점,,연두언니12,4.20.월,부모님과 아이들 같이 왔는데 양도 많고 종류가 다양해서 너무 좋았어요 아이들이 여긴 꼭 리뷰남겨야 하는곳이라 하네요
제주할망밥상 차귀도점,,소망둥이13,4.18.토,여러가지 색다른 생선 반찬 모두 맛있게 잘 먹었어요
제주할망밥상 차귀도점,,노연주60,4.16.목,"할망 밥상 여기저기 가봤는데, 차귀도점 뷰도 너무 좋고 부모님과 왔는데 너무 만족 하셨어요. 잘 먹고 갑니다.!!뷰 맛집 생선 맛집!"
제주할망밥상 차귀도점,,shs****,4.16.목,할망 그날 정식 구성도 정말 알차고 종류별로 생선이 나오는데 다 맛있어요! 같이 나오는 반찬도 훌륭합니다 차귀도 맛집이여요! 잘먹고 갑니다
제주할망밥상 차귀도점,,par****,4.15.수,뷰도 이쁘고 친절하고 맛나요🙌
줄라이앤어거스트,,silverjewel,3.20.금,공간도 넓고 사진이 너무 잘 나와요
줄라이앤어거스트,,ife****,3.19.목,햇살좋은 봄날 와이프와 줄라이앤어거스트 방문했습니다. 커피도 맛있고 디저트도 맛있고 뷰가 맛집이라 사진 엄청 잘나오네요!
줄라이앤어거스트,,drchuuk,3.16.월,제주 올레13코스 상에 우연하게 만난 멋진 카페.  라떼 한잔으로 쉼을 누린다. 내부의 아기자기 한 소품도 멋지고 음악도 멋졌다 많은 순례객들이 다녀가길 기대해 본다
줄라이앤어거스트,,란나,2.20.금,"이번 제주 여행 중에 갔던 카페 중에 분위기 원탑이었어여!! 채광 맛집이라 창가 자리가 완전 포토존이구💚  빈티지 식기 구경 하는 재미도 쏠쏠 하고 공간이 넓어서 여유롭게 힐링하기 좋네여ㅎㅎ  시그니처 줄라이라떼는 엄청 고소하고, 복숭아라떼도과육 씹히는 맛이 최고였어요🤤 버터스콘 풍미가 대박이고 겉바속촉 그 자체🤎"
줄라이앤어거스트,,맛있으면노멘트,2.19.목,26.2.19. Th
줄라이앤어거스트,,조이로건,2.14.토,아침 일찍 방문하니 갓 나온 스콘도 먹을 수 있었고 시그니처 줄라이 어거스트 라떼를 같이 먹으니 너무 맛있었습니다! 라떼들 첫 한입 먹자마자 눈이 번쩍 떠지더라구요ㅎㅎ  스콘은 비스킷과 가까웠는데 속은 또 부드러운 스콘이고..딸기잼이랑 버터 같이 먹으니 완전 꿀맛 👍 너무 저희 취향이였습니다!  인테리어도 완전 예쁘게 해두셔서 사진도 잘 나오고! 부부 사장님 두분 모두 멋지고 친절하셔서 좋았습니당
줄라이앤어거스트,,jjangoooooo,2.9.월,"두번째 방문!! 🫖☕️ 공간이 참 예쁩니다^^~ 제주에서 가본 곳 중 다섯손가락 안에 들 정도로 너무 예뻐요, 디저트도 맛납니다 🍓"
줄라이앤어거스트,,먹을때행복이,1.22.목,카페 너무 예뻐요~!! 인테리어 하나하나 신경쓰신게 느껴져요~ 커피도 맛있습니다
줄라이앤어거스트,,라라의 맛있는 집밥,1.20.화,"아담하고 예쁜 카페 한참 찾다가 발견해서 왔어요. 창이 커서 채광이 좋아 카페 분위기가 따뜻하고 아늑해요. 곳곳에 아기자기한 소품이 많아서 구경하는 재미가 있네요.  아이스 아메리카노, 과테말라 필터커피, 복숭아라떼 주문했어요. 커피가 향도 좋고 맛있네요. 복숭아라떼에는 복숭아 알갱이가 가득 들어있어 식감도 좋고 맛있었어요.  다음에 제주 오면 또 들르고 싶은 카페예요. 힐링 잘 하고 갑니다."
줄라이앤어거스트,,부루92,1.5.월,카페가 유럽 온거처럼 소품이며 인테리어가 너무 이쁘고 드립커피 넘 깔끔하고 맛있어요~ 스콘이랑 먹기 딱!! 어거스트라떼도 옥수수크림맛 많이 나서 좋네요~~ 또 오고 싶은 카페!!
풍차와 전복,,메리엔메리,4.22.수,전복 버터구이 세트 아기랑 먹기 좋았고 너무 너무 맛있게 잘 먹고 갑니다^^*
풍차와 전복,,하놔바람,4.22.수,숙소 주변 맛집 검색해서 왔는데 현지 분들이 대부분인 식당이었습니다 맛있게 먹고 갑니다
풍차와 전복,,정옥찌,4.22.수,진짜 너어어어어어무 맛잇어요... 기본반찬 하나하나 다 정성스럽고 구이들은 알맞게 구워져서 입에 딱 맞아요 ㅠㅠ 태교여행중에 행복한 아침이었네요❤️
풍차와 전복,,떠꺼바,4.21.화,인터넷 검색후 첨 방문하는곳인데요~! 뷰맛집~^^전복 무침셋트 맛 짱임돠ㅎ 오늘 점심 메뉴 선택 진짜 잘한거 같네요ㅋ 담에 또 오고싶네욧ㅎ^^♡
풍차와 전복,,bky****,4.21.화,만육천원에 솥밥에 고등어구이에 게장에 미역국까지.. 진짜 맛있어요! 게우젓이란거 처음 먹어봤는데 .. 진짜 맛있구 전복이 안들어간데가 없어요! 물회에 소면 추가했는데 소면을 거의 2인분어치로 주시더라구요.. 사장님 큰손 인정입니다! 네이버 서치하다가 왔는데 이정도일 줄 몰랐어요! 다음에 제주도 다시 오면 또 오고싶어요!!
풍차와 전복,,이승제27,4.19.일,집으로 돌아가는 날 지인의 추천으로 방문한 식당입니다 메뉴는 제주에서 흔하지만 맛이나 깔끔함은 재방문을 생각하게합니다 잘먹고갑니다 다음에 또 올께요
풍차와 전복,,lee****,4.19.일,제주 서쪽 왔다가 유명한 전복 전문점이라고 해서 방문했습니다 전복버터구이 셋트 주문했는데 전복돌솥밥에 고등어구이에 전복버터구이까지 정말 다 흠잡을데 없이 완벽했어요 곁들임 반찬이랑 게우장도 다 맛있어서 싹싹 비웠답니다 또 방문할게요!
풍차와 전복,,kim****,4.19.일,전복버터구이세트! 아이들 먹기 좋은 고등어 구이와 한라산과 갓페어링 전복버터구이 정말 맛있게 먹고 가요:)
풍차와 전복,,둉로22,4.19.일,재료가 너무너무 신선하고 맛있어요!! 고등어구이는 정말 실하고 맛있고 전복버터구이는 대박입니다.. 부드럽고 녹진하고 너무 맛있어요!! 아기의자도 구비되어있어 아기와 함께 맛있게 먹었습니다^^
풍차와 전복,,mjkl6666,4.19.일,전복 무침 세트 양도 많고 너무 맛있어요 :) 2인이 배불리 먹었어요 추천입니다!!
하소로커피,,trebelle,4.21.화,스콘 찾다가 한경면까지 왔습니다. 호밀로 스콘을 직접 만드시다니요.!! 제주에서 호밀빵 찾기가 하늘에 별따기인데...;;  커피는 원두를 고를 수 있어서 아주 좋았습니다. 개인적으로 산미를 안 좋아해서 고소한 아메리카노~ 시그니처 라떼와 짭쪼리한 스콘~ 만족 가득 담아 갑니다. ㅎ  참~ 텀블러 들고가면 커피백(1개)도 선물로 주십니다. 참고하세요~^ㅡ^
하소로커피,,yaung69,4.16.목,커피도종류가 다양하고 분위기도 넘이뻐요
하소로커피,,Risso,4.7.화,커피도 맛있고 분위기도 좋아서 책읽기도 좋아요~ 와이프랑 간만에 즐겁게 카페 데이트 했습니다
하소로커피,,Mmargarett,4.4.토,라테가 너무 맛있어요!! 지인들 선물로 원두랑 드립커피도 샀는데 선물하기도 너무 좋아요 오전이라 사람들도 없고 여행와서 마셔본 커피중에 젤 맛있었어요!!
하소로커피,,Cloud9996,4.3.금,"☕ 제주 조수리에서 만난 인생 커피, '하소로 커피'  제주 서쪽 조용한 마을 조수리에서 정말 제대로 된 로스터리 카페를 발견했어요! 공간이 주는 차분함 덕분에 여행 중 잠시 쉬어가기 딱 좋은 곳입니다.  1. 🌿 조용하고 감각적인 분위기 마을 풍경과 어우러진 카페 외관부터 내부의 감각적인 인테리어까지, 제주만의 여유로움이 가득 느껴집니다. 혼자 방문해서 창밖을 보며 커피 한 잔의 여유를 즐기기에 이보다 더 좋을 수 없더라고요.  2. ☕ 특별한 아메리카노 이곳의 아메리카노(특별한)를 마셔봤는데, 정말 이름 그대로 '특별'합니다. 기분 좋은 산미와 깔끔한 뒷맛이 입안을 산뜻하게 해줘요. 로스팅 실력이 대단하시다는 게 한 입 마시자마자 느껴집니다!  제주의 진정한 커피 맛집! 하소로 커피, 재방문 의사200%"
하소로커피,,깽이5548,4.2.목,"(200% 내돈내산 리뷰입니다) 지난 여행 때 마신 커피 맛이 잊혀지지않아서 다시 방문했어요! 여행 경로에서 벗어나도 찾아갈만큼 여전히 맛있네요~! “맛있는” 커피를 좋아해서 여기저기 찾아자니는데, 하소로 커피는 그중 탑입니다..  다양한 원두 중에서 고르는 재미도 있고 다 맛있어서 줄어드는 걸 아쉬워하면서 먹었네요 ㅎㅎ (자칭) 커피 박사. 엄마도 황홀하다고 하셨어요 ~!  오래오래 장사해주세요~~!"
하소로커피,,adorablekiki,3.29.일,"오늘 아아는 특별한, 강력한 두 가지 다 크게 맛있게 느껴지지 않았어요. 조수리가 달콤해서 그런가? 디저트 좋아해서 빵 잘 나오는 카페 좋아하는데 여긴 스콘이 메인이고 (딱 한 번 먹어봤는데 쏘쏘) 바치케는 너무 맛없게 생겨서 패스.. 냥이 너무 귀여워서 힐링했어요"
하소로커피,,호기심만땅소녀,3.1.일,"기대가컸는지 살짝실망감 ㅜ 블랜딩 아메리카노마셨는데맛이 무난했어요. 공간은차분하고 포근해요. 스콘이디저트인데 버터의깊고고소한 풍미보다약간 오일리한향이더나서 제취향이아니었고,  2층복층자리가하나있는데 나름주변에서어슬렁거리며노렸는데 앉으신분이한시이넘게안나가시네요 ㅋ 저와같은마음이었나봐요 ㅋㅋ 다음에기회되면 핸드드립으로마셔보고싶어요."
하소로커피,,봉순냥이,2.27.금,"카페 분위기도 좋고, 커피도 맛있어요. 스콘도 맛있게 먹었어요. 드립백과 원두도 판매해서 원두도 사왔어요. 창가쪽 자리엔 읽을만 한 책들이 제법 있어서 책 읽기도 좋아요. 그리고 고양이 소로가 귀여워요:)"
하소로커피,,미이식가,2.16.월,커피 원두 신선해서 자주 이용합니다~^^
모살왓가든,,kkk****,4.11.토,로컬지인추천으로 왔는데 흑돼지 정말 맛있게먹었어요 정신없이 먹느라 다 먹고나서야 사진 찍었네여 고기 밑반찬 찌개 뭐 하나 빠짐없이 좋았습니다 특히 며칠간 주차문제로 밥먹으로 갈때마다 스트레스 였는데 주차장이 넓어서 좋았어요
모살왓가든,,ouruni,3.14.토,내용 없음
모살왓가든,,달이 차오른다 가자,3.10.화,"자투리는 1인 200g인데 2인분 해서 300g이 안될 것 같습니다. 고기는 맛있었어요. 톳돌솥밥은 오천원인데, 톳이 최소 3일은 된 것 같아요. 식감과 향이 떨어집니다. 된장찌개는 3천원인데, 색과 맛이 된장찌개 색이 아니에요. 밑반찬은 다양하게 나옵니다. 장아찌가 맛있습니다. 톳 반찬과 콩나물무침은 만든지 오래됐어요 ㅜ"
모살왓가든,,omj****,2.12.목,음식이 맛있어요~
모살왓가든,,ㅁ네모,1.27.화,2명이서 흑돼지모듬 2인 주문했어요 양이 적지 않아서 배부르게 먹었습니다~ 계란찜도 안에 파가 들어있으니 맛있어요 상추도 싱싱하고 파절이도 맛있습니다
모살왓가든,,하랑아범65,1.8.목,현지인 맛집이에요 근처 펜션 사장님 소개로 왔는데 칠돈가 같은 맛과는 좀 다르네요. 현지인 맛집이고 반찬은 직접해주신것들이라 기성품 아니어서 좋았어요~~ 직원기타 사장님까지 중국분들 같은데 희안하게 친절합니다 ㅋㅋㅋㅋㅋㅋㅋ~~~ 찌개부터 고기까지 로컬틱하지만 퀄리티 매우좋고 셀프바 잘 되어있어 반찬 알아서 갖다먹기 편하네요~~^^
모살왓가든,,nsh2537,25.12.18.목,제주 한경 연탄구이 맛집 모살왓가든 가성비 흑돼지구이 맛집이더리고요
모살왓가든,,배츄토끼,25.12.16.화,제주에서 먹었던 흑돼지중 최고입니다! 진짜 고기 질이 최고에여 고소그자체ㅜㅜ 술이 꿀떡 다른 반찬들로 기교부린곳과 달라요..... 진짜 진정한 고긱술파 출동하세요~~~!! 👍👍 평점 5좀입니당.. 💕
모살왓가든,,코코63,25.10.14.화,고기가 쫄깃하고 맛있어서 아이들도 잘 먹고 톳밥도 맛나요~배불리 잘 먹고 가요 추천 합니다
모살왓가든,,산미있는라떼,25.10.10.금,제주도 오겹살 여기저기 웨이팅이 너무 길어서 세번째로 방문했는데 생각외로 맛있게 잘 먹었습니다. 공간도 크고 웨이팅도 없어서 편하게 야외자리에서 잘 먹었어요. 친절하시네요 고기질도 좋습니다 오겹살 목살도 괜찮은데 짜투리 살이 의외로 더 맛있었어요! 츄라이 해보시길
명리동식당 본점,,브라이언14,4.19.일,전국 자투리고기 원조 명리동식당에 왔어요. 여기 오시면 잘모르는분들은 흑돼지 먹는데. 여기는 자투리가 1등입니다. 물론 흑돼지도 맛나요. 김치찌게도 맛나니 한번 드셔보시길.
명리동식당 본점,,뻣쭈,4.9.목,"목살, 삼겹살, 자투리고기, 반찬 모두 정말 맛있었어요!! 아가랑 식당가면 고기굽기 힘든데 직접 구워주시니 편하게 먹을 수 있었어요^^ 아기의자도 있어서 아가가 편하게 먹을 수 있었고, 초딩 첫째는 자투리 고기가 너무 맛있다고 해서 추가해서 먹었어요~4인가족 고기 1kg 정말 맛있게 잘 먹었습니다♡"
명리동식당 본점,,별달집사,4.2.목,생각보다 웨이팅 금방 빠지고 맛은 흠잡을 곳 없이 좋았어요.. 많이 바쁘신 것 같긴해요 T-T
명리동식당 본점,,lee****,3.29.일,너무급히 먹는바람에 사진을못찍엇음요~ 10년전부터 1년에한번은꼭들리는 식당 사장님한결같으시고 고기질 한결같고 고기가성비 금액 변함없고 제주도 오시면 꼭한번 들릴만한 고기집입니다 완전강추 사이다 콜라 서비스감사했습니다 ^^ 번창하세요~
명리동식당 본점,,맘엔마미,3.25.수,맛있어요
명리동식당 본점,,kanta89,3.21.토,연탄불에 구워서 그런지 고기가 더 맛있음
명리동식당 본점,,Suvely2,3.1.일,가성비 좋고 맛나요 잘먹었습니다!
명리동식당 본점,,jjgongju1118,2.27.금,"자투리 고기와 김치전골 꼭 드셔보세요! 너무 맛있어요:) 직접 구워주셔서 식사도 편안하게 했고, 주차장도 따로 마련되어 있어서 좋았어요~"
명리동식당 본점,,joo****,2.26.목,소문듣고 왔는데 식감좋은 짜투리고기조 맛있고 목살도 단백하고 김치찌개도 진짜 좋아요. 재방문 의사 100%입니다~ 여행와서 잘~~~먹고 가요!
명리동식당 본점,,푸른산하,2.7.토,제주에 오면 늘 방문합니다. 10년전에도 오늘도~~ 평소에 먹던 퍽퍽한 목살이 아닌 부드러운 목살~ 오늘도 맛나게 먹고 갑니다.
한경가든,,Yonchi15,4.20.월,갈치 조림 구이 맛집이네요 우연히 들렀는데 유명인이 엄청 다녀갔네요 순살 갈치조림 최고예요 가성비 좋고 가시 걱정 없이 정말 맛있게 먹고갑니다. 둘이서 2인분 그리고 갈치 구이 까지 싹싹 먹었습니다 다시 오고싶네요
한경가든,,idh****,4.19.일,가금씩 와서 먹는 한경가든 고등어구이 정식 넘 맛있어요~~~♡ 밑반찬도 신선하고 깔끔 담백합니당^^
한경가든,,낭낭낭09876,4.18.토,"조미료 들지 않은, 근데 맛있는 맛이에요! 단체손님을 위한 테이블도 있고 메뉴도 알차요! 밑반찬도 맛있어요ㅠㅠ 부모님 모시고 다시 오고싶은집 입니다."
한경가든,,zla****,4.16.목,가시 발라내는 번거로움 없이 편하게 먹을 수 있고 자극적이지 않고 싱싱한 갈치의 맛까지 느껴져서 아이들이나 부모님 모시고 가기에도 좋은 메뉴 같아요 편하게 먹을 수 있으면서도 맛까지 제대로 잡은 곳이라 만족스러운 식사였습니다 👍  제주 여행 중 든든한 한 끼로 딱이었던 한경가든 다음에 또 방문하고 싶은 곳이에요 :) 제주 한경면 맛집! 제주 로컬맛집 인정!
한경가든,,rar****,4.16.목,오랫만에 와서 먹었는데 여전히 너무 맛있네요 ㅎㅎ
한경가든,,김구리구,4.14.화,"양파랑 무로만 맛을 낸다고 하셨는데 그래서 그런지 더 건강한 느낌이였어요 🥰 뼈도 다 발라져있고 야들야들 살코기만 있어서 애기보면서 밥먹기 너무 수월했고요..⭐️  특히 아이랑 같이 여행하시는 분들, 부모님 모시고 가는 여행이라면 더더욱 추천드려요! 자극적이지 않고 건강한 맛이라 누구나 좋아할 스타일이에요 😊  저는 다음 제주여행 와도 무조건 재방문 할꺼에요!!"
한경가든,,kkokkoma,4.13.월,"뼈없는갈치조림이랑 간장게장 주문했는데, 한경가든은 반찬부터 하나하나 다 정갈하고 맛있어서 기분 좋게 식사했어요. 갈치는 생물이라 그런지 살이 부드럽고 비린내 없이 정말 맛있었어요! 간장게장도 짜지 않고 밥도둑이에요 👍 매장 내부도 전체적으로 깨끗하고 정돈된 느낌이라 편안했고, 귀여운 마스코트 고양이까지 있어서 더 정감 갔어요 🐱 제주 오면 한경가든 또 방문하고 싶어요!"
