Search_Query,Place_Name,Nickname,Date,Review_Content
유람위드북스,,어쩌다장미,25.11.13.목,"책방올레를 하면서 이미 두번을 왔던 곳이에요. 서점처럼 책을 구매하는 것보다 책을 읽을 수 있는 북카페가 더 어울리는 [유람위드북스]죠~ 아마 음료 마시며 책을 읽거나 개인작업을 하시거나 하는 분들을 많이 뵈었을거에요.  이번 여행을 함께하는 동행자가 가보지 않은 공간이라고 해서 함께 다녀왔는데 역시 창가좌식자리는 만석! 중간에 자리가 생겨 앉을 수 있었답니다.ㅎㅎ 근데 책에 집중하고 싶다면 2층 1인자리도 추천드려요. 저는 주로 2층에서 책을 읽는 경우가 많았어요. 그렇지 않으면 이것도저것도 아니게 시간을 보내고 오게 되더라구요.  비록 유람이(고양이)가 떠났지만 유람이를 기억하며 추모하는 메모들도 가득찼고, 사장님 역시 제주책방올레 여권을 구매해서 직접 하고 계셨어요. 나도 도전해볼까?^^;"
유람위드북스,,추몽가,25.10.8.수,좋아서 넘~~ 좋아서 이틀 연속으로 옴. 자리 날 때 까지 밖에서 대기. 기다릴 가치가 있는 곳
골든망고 신창풍차해안본점,,dnj****,4.21.화,넘 맛있어요~~^^
골든망고 신창풍차해안본점,,saico50,4.21.화,여기 사장님 너무좋고 망고리치보다 더 맛있네요 찐 맛집입니다
골든망고 신창풍차해안본점,,Azkaban,4.21.화,제주도 걸어서 일주중에 방문한 매장이에요. 날씨도 너무너무 좋은데 골든망고쉐이크를 파는 매장이 보여서 얼른 들어와서 주문하는데 사장님께서 너무너무 친절하게 맞아주셔서 정말 감사했어요. 막 나온 망고가 너무 달고 부드러웠어요. 당충전 확실히 하고 다시 발걸음을 옮겨봅니다ㅎ
골든망고 신창풍차해안본점,,mjkl6666,4.19.일,신창풍차 해안도로를 달리다가 우연히 발견한 골든 망고! 망고쉐이크 맛있어요 :) 사장님도 친절해요 :)
골든망고 신창풍차해안본점,,도리도리4150,4.8.수,사장님 넘 친절하시고 ㅎㅎ 망고쥬스 넘 맛있어요!!^^
골든망고 신창풍차해안본점,,qkr****,3.23.월,망고스무디 먹고싶어서 왔어요ㅎㅎㅇ
골든망고 신창풍차해안본점,,asdewq41,3.21.토,신창풍차해안도로를 따라 달리다가 들린 골든망고집! 메인메뉴인 골든애플망고를 주문해서 먹었는데 너무 맛있네요~~~ 무엇보다 사장님이.친절하십니다^^
골든망고 신창풍차해안본점,,주미흴피거,3.20.금,제주 여행 중에 방문했어요! 달콤한 망고쉐이크가 먹고싶었는데 여기서 먹게 되네요!! 뷰 좋은 곳에서 잘 즐기고 갑니다♥️♥️ 진짜 100% 망고로 만든거라 정말 맛있어요!! 양도 넘치게 주시고 넘 감사합니다~~
골든망고 신창풍차해안본점,,ahhhhhh54,3.5.목,너무 친절하시고 해안도로 드라이브 하다가 들러서 망고쥬스 한잔 하기 좋습니다 근처 풍차도 바로 들러서 바다랑 같이 보기 너무 좋습니다
골든망고 신창풍차해안본점,,흥인경희한의원,3.4.수,아이들이 망고를 좋아해서 제주 올때마다 먹습니다
노고롯1985,,자두자두해,4.20.월,단골이에요~~^^ 좋은 음악들으면서 아침먹으러 오면 너무 좋아요. 음식도 너무 맛있고 사장님도 친절하세요! 앞으로도 자주 올게요!❤
노고롯1985,,psh****,4.20.월,브런치로 소세지브런치랑 양갈비스테이크 먹었어요! 네이버에서 검색하다가 음식이 맛있어 보여서 왔는데 맛도 맛이지만 공간의 분위기가 너무 멋져요 내부도 외부도 정성들여 관리하신 듯해서 더 머물고 싶어지는 것 같아요! 잘 먹고 짧은 시간이지만 잘 머무르다 갑니다😊
노고롯1985,,부엉이635,4.19.일,내용 없음
노고롯1985,,솔이맘29,4.19.일,"명란이 이태리에 있다면.... 이삭이가 다녀가서 찾아왔지만 기대 그 이상인 곳입니다~~^^ 나무냄새,바람..맛.. 오래오래 해주세요~♡"
노고롯1985,,minhavida,4.18.토,곳곳이 너무 아름다운 공간이에요 🤍🤍 테이크아웃 하는게 아쉬울 정도로 예쁘고 좋아요! 다음번엔 꼭 안에서 먹고 갈래요 :)
노고롯1985,,hyn8,4.18.토,인테리어가 예쁘고 편안해서 분위기가 좋아요 사장님도 친절하시고 클래식 음악 덕분에 아늑한 분위기에서 너무 맛있게 잘 먹었습니다!!
노고롯1985,,유미나43,4.18.토,일단 음식이 너무 맛있어요!! 부모님모시고왔는데 너무 좋아하셧어요 ㅎㅎ 외부에도 사진찍을 공간이 있어서 좋고 내부도 너무 멋지게 꾸며놓으셔서 여기저기 사진찍고 놀았습니다 ㅎㅎ강추합니다!
노고롯1985,,min****,4.18.토,아침 먹을 곳 찾다가 아이와 방문 했어요~ 파니니가 정말 맛있어요!!!! 착즙주스 상큼하니 아이도 잘 먹고 커피도 맛있어요~ 주변 산책하기도 좋고 고요하니 좋아요😊 사장님 친절하십니다~ 노고롯 브런치 메뉴는 저한테는 가격대비 살짝 아쉽다 생각했는데 산책하면서 보니까 대부분의 재료를 키우시는거 같더라구요~ 신선한 재료로 만든 음식 맛있게 잘 먹었습니다😄
노고롯1985,,mkh****,4.16.목,아기에게 친절하시고 음식도 너무 맛있어요
노고롯1985,,hye****,4.16.목,내륙 시골마을에 위치하고 있어 정원과 실내 인테리어도 너무. 좋습니다. 바닷가는 아니지만 울창한 나무들이 많이 있어 숲속뷰로 자연적인 분위기로 고즈넉하니 오랫만에 클래식 음악으로 힐링하고 왔습니다. 사장님께서 직접 현악기도 제작하시고 이곳에서 5월에는 연주화도 한다고 하니 꼭 다시 방문하겠습니다.
신창풍차해안도로싱계물휴게소오징어덕장,,angel5805,4.22.수,오징어가 부드럽고 맛있어요!!매장도 쾌적하고 사장님도 친절하십니다 :)
신창풍차해안도로싱계물휴게소오징어덕장,,ㅁ밈미,4.21.화,오징어가 질기지도않고 너무 맛있었어요! 뷰도 좋고 사장님들도 친절하십니다👍🏻👍🏻
신창풍차해안도로싱계물휴게소오징어덕장,,나른한 오후95,4.21.화,오랫만레 신창해안도로 구경왔다가 새로생긴 휴게소가 있어서 너무 반가웠어요! 크기별로 오징어 고를수도 있고 직접 바로 구워주시기 때문에 너무 신선하게 먹을수 있었어요!! 소스도 서비스로 챙겨주셨어요!! 도민이기에 종종 들려서 먹어줘야겟어요! 잘먹엇습니다!
신창풍차해안도로싱계물휴게소오징어덕장,,꾸벅16,4.21.화,이날씨에 이런호사 ㅋ ㅋ 너무 맛있게 잘먹었습니다
신창풍차해안도로싱계물휴게소오징어덕장,,pr7****,4.21.화,"40여년이 넘게 해풍에 반건조오징어를 건조하던 제주전통덕장으로,싱싱한 반건조오징어를 맛볼 수 있는 곳으로, 맥반석구이의 은은한 불향과 해풍에 70%정도 말린 반건조오징어의 쫄깃한 식감이 일품입니다. 마요네즈와 매운 청양고추를 섞은 특제 소스가 맥반석 반건조오징어의 맛을 한층 업그레이드해주며, 맥주나 소주와 함께 즐기기 좋습니다. 음료 커피 천혜향쥬스 물 등도 판매합니다. 사장님의 친절한 응대와 위생적인 손질 과정으로 안심하고 먹을 수 있고 신창항 신창풍차해안도로와 싱계물공원의 저녁노을과 여러 풍경을 접할수 있어 가족이나 친구와 함께 방문하기 적합합니다. 주차는 신창풍차해안도로싱계물공원 휴게소의 넓은 무료주차장이 있어 더욱 편리합니다. 본 싱계물 오징어덕장은 40여년전부터 해풍으로 반건조 오징어를 말리던곳"
신창풍차해안도로싱계물휴게소오징어덕장,,ㅡ67,4.21.화,바로앞에 바다 뷰라 너무좋아요!! 한치도 맛있어요><
신창풍차해안도로싱계물휴게소오징어덕장,,Alexander43,4.19.일,오징어 맛있어요 쫀드기도 맛있어용
신창풍차해안도로싱계물휴게소오징어덕장,,이재무우,4.19.일,우연히 드라이브중 들른 싱계물휴게소!! 직접 구워주시는 오징어 짱입니다 완전강추!!!
신창풍차해안도로싱계물휴게소오징어덕장,,GAEUNY,4.19.일,오징어가 너무 부드럽고 촉촉하고 두툼해서 너무 맛있어요! 집에가져가서 또 먹으려고 포장도 했어요🥰
신창풍차해안도로싱계물휴게소오징어덕장,,올해는성공한다,4.18.토,맥반석에 갓구워주시는 반건조오징어 최고 🦑 맛없없 최고의 푸드 직원분들도 넘 친절하시고 주차장도 넓어요 추천추천합니다
풍차로 가는 길,,선티처,4.20.월,맛 친절 뷰좋아요
풍차로 가는 길,,빛나라별콩콩,4.19.일,시그니처 싱계물오션러떼 달달하면서 맛있어요 옥수수찰빵은 속안에 옥수수 앙고 듬뿍!!! 맛있어요. 잠쉬 쉬면서 힐링 하고 갑니다
풍차로 가는 길,,Stella254,3.31.화,"뷰맛집이에요. 커피, 과즐도 맛있습니다~"
풍차로 가는 길,,shi****,3.20.금,매장이 넓고 깨끗해요 신창풍차해안을 보러왔을 때 커피 한잔의 여유를 즐겨보는 것도 좋을 것 같아요  원두도 고소하고 맛있어요!
풍차로 가는 길,,ari****,3.20.금,주차장이 넒고 바로 앞 바다와 풍차가 있어 제주에 분위기를 즐기며 쉬다가 가기좋아요
풍차로 가는 길,,food is my life,3.20.금,풍차 바다뷰가 좋았고 카페가 무려 2층이여서 쾌적했어요 3층은 루프탑이 있어서 사진 찍기도 좋습니다!  그리고 주차자리도 넉넉해서 편하게 주차하고 쉬다가네요!
풍차로 가는 길,,dea****,3.20.금,풍력발전도 구경할겸 쉬엄쉬엄 커피마시기 좋은 장소 같습니다!
풍차로 가는 길,,thd****,3.18.수,감귤카페라떼랑 땅콩라떼 시켰는데 둘다 너무 맛있었어요! 카페도 크고 넓어서 가족끼리 와도 좋은곳같아요.
풍차로 가는 길,,sum****,3.18.수,너무 좋아요 뷰맛집~비가 와서 아쉽지만 짱입니다~바다가 한눈에~~^^
풍차로 가는 길,,ica****,3.13.금,뷰가 너무 멋지고 친절해요~ 음료도 맛있고 크로와상도 저렴하고 맛있어요♡♡♡
로비,장소 찾기 실패,해당 없음,해당 없음,해당 없음
제피로스,,시로니0,4.17.금,뷰맛집이예요 잠깐 시간이 남아 들렸는데 맛있는 디저트 엄청 많아요 특히 생크림케익 꼬 꼭 추천입니댜
제피로스,,임프로디테,4.17.금,"사장님이 너무너무 친절하고 디저트도 다양하고 넘 맛있어요!!♥️♥️♥️  에그타르트, 버터떡 , 쿠키 진짜 강추에요ㅠㅠㅠ♥️♥️♥️에크타르트 포르투칼 안가도됩니다."
제피로스,,go****,4.15.수,부모님이나 일가친척들 모시고 오면 칭찬받을듯한 대형정원카페 ㅎㅎ
제피로스,,wi****,4.15.수,딸기가 정말 가득들었어요! 아이들 기념일이라 주문했는데 너무 맛있네요:) 케이크를 다먹은건 처음이에요ㅎㅎ 카페 뷰도 좋아요~ 이번엔 딸기케이크만 픽업했는데 다음번에는 카페도 이용해보려구요~
제피로스,,m00aa,4.15.수,딸기생크림케이크 먹으러 왔어요. 동물성생크림을 사용한 딸기케이크. 겉에만 딸기가 둘러진게 아니고 케이크속에도 딸기가 듬뿍들어간 맛있는 케이크~~
제피로스,,임프로디테,4.15.수,"급하게 연락드렸음에도 불구하고, 사장님이 넘 친절하게 응대해주셔서 기념일날 맛있고 예쁜 케이크 픽업 할수 있었어요!  케이크 픽업 하러갔는데 맛있는 디저트 들이보여서 에크타르트랑 버터떡, 쿠기 주문했는데 진짜 너무 맛있어요ㅠㅠㅠㅠ  케이크 맛집 뿐만아니라ㅠㅠ 디저트 맛집 ㅠㅠ♥️ 오션뷰여서 날좋은날 가면 더 좋을것 같아요  무조건 강추인 제피로스💛"
제피로스,,실론제주의기준은,4.15.수,"한경면 쪽에서 카페 찾다가 들렀는데, 여기 뷰가 진짜 좋네요. 들어가자마자 바다가 확 보여서 자리 앉자마자 한참 멍 때렸습니다.  이런 곳은 보통 뷰만 좋고 음료는 아쉬운 경우 많은데, 커피도 생각보다 괜찮았어요.  조용한 분위기라서 잠깐 쉬어가기 좋았고, 여행 중간에 들르기 괜찮은 카페였습니다. 한경면 근처에서 카페 고민되면 한 번 가보셔도 좋을 것 같아요.  나오는길에 케익도 포장해서 왔는데요. 여긴 케익 맛집이었네요! 생과일 케이크 드셔보세요. 진짜 맛있어요!"
제피로스,,loveksth,4.12.일,결혼기념일 맞춰 제주여행왔는데 케이크가 빠져서 급하게 찾은 제피로스! 기대안하고 먹었는데 너무 맛있잖아요😍 크기도 가격도 맛도 완벽그잡채👍 딸기만 제철이였다면 달달했을테지만 그래도 맛도리! 픽업시간 늦었는데도 이해해주시고 제피로스 최고에요!!❤️
제피로스,,ffw****,4.12.일,아이 생일이라 케이크 찾아 왔는데 망고랑 딸기를 폭탄급으로 듬뿍 올려주셔서 아이들과 원없이 맛있게 먹었어요 ㅎㅎ 어디서 봐도 멋진 경치에 친절하신 사장님 부부 덕분에 즐거운 추억 남기고 갑니다😊
제피로스,,히힛3224,4.11.토,제주도 올때마다 오는 뷰 맛집 제피로스입니다! 너무 추천합니다! 음식도 맛있고 매장도 깔끔해여
"고산의 낮 , 고산의 밤",,현지7728,4.15.수,"2시간을 예약 했는데, 시간이 너무 빨리 가서 아쉬웠어요. 3시간 예약 하면 좋을 것 같아요. 앉으면 방명록 읽고 책 종류도 많아서 뭐 읽어야 할지 고민하다가 시간도 많이 흐르고 또 책 읽으면 시간이 금방 흘러요. 집중 하는 시간이 좋았고 향도 좋고 차분한 음악도 좋았습니다."
"고산의 낮 , 고산의 밤",,호승50,4.13.월,두시간이라는 시간이 이렇게 짧은줄 몰랐습니다. 두시간 동안 온전히 집중할 수 있는 시간이었고 공간의 온도나 분위기 모든게 완벽했습니다. 저는 책보다는 방명록을 읽고왔는데 시간은 다르지만 똑같은 공간을 공유한 사람들의 이야기를 보고있으니 뭔가 새로운 기분이 들더군요.
"고산의 낮 , 고산의 밤",,lpziian,3.31.화,여행에서 돌아와서도 매일 생각나는 공간이에요 2시간동안 편안하게 혼자만의 생각 정리를 할 수 있었어요. 그리고 방명록 읽으면서 많은 위로도 받았어요. 다음번 제주 여행때도 꼭 방문할거에요!
"고산의 낮 , 고산의 밤",,정이ㅇ,3.22.일,"너무너무 하고 싶은 말이 많은 '좋은 곳'이었어요.  혼자 여행을 왔거나 혹은 생각이 많다면, 생각하기 싫거나 잔잔해지고 싶다면, 위로가 필요하다면, 혼자만의 온전한 시간이 필요하다면 이곳에 꼭 들러보세요.  요즘 일상에서 느끼기 힘든 여유라는 것을 느낄 수 있었습니다."
"고산의 낮 , 고산의 밤",,우동이65,3.18.수,매장 찾기가 조금 힘들었어요. 간판이 아주 조그맣거든요. 공간활용을 정말 잘 하신 거 같아요. 인테리어에 먼저 놀랐어요. 먼저 방문하신 분들의 방명록을 읽는 것만으로도 힐링이 되는 시간이었어요.
"고산의 낮 , 고산의 밤",,paleblue089,3.18.수,조용하고 아늑한 곳....체리하이볼도 맛있고...🍒 좋은 시간 보내고왔어요~^...^
"고산의 낮 , 고산의 밤",,사개월76,3.1.일,혼자 온 제주에서 보물같은 곳을 또 발견해 기분이 너무 좋았습니다. 고즈넉한거 좋아하시는분들 혼자 여행오시는분들에게 좋은곳입니다. 돈이 하나도 아깝지 않았어요
"고산의 낮 , 고산의 밤",,쟌망루퓌,2.25.수,제주에 이런 멋진 곳이 있었다니..... 따뜻하고 아늑하고..... 너무 좋았습니다 쉼이 필요한 분들한테 딱 좋을 장소입니다! 힐링하고 갑니당~~!
"고산의 낮 , 고산의 밤",,수박박박수,2.10.화,아무 계획 없이 온 제주에서 유일하게 예약한 일정이었어요! 방명록 읽고 쓰는 것만으로도 두시간이 훌쩍 가더라고요. 따뜻한 위로와 쉼이 있는 공간이었어요. 다음 번 제주 여행이 언제가 될 진 모르겠지만 꼭 다시 방문할게요!
"고산의 낮 , 고산의 밤",,여긴어디나는뉴규,2.1.일,꼭 다시 가고야 말겠읍니다..
한라당몰국수,,하윤8760,3.30.월,"공항가기직전 숙소근처 고기국수집 찾아보다 우연히 들렸는데, 모든재료가 제주산, 국내산인 최고의 식당... 로컬식재료라 그런지 진짜 신선하고 맛있어요! 중국산 호주산으로 범벅된 요즘 정말 보기힘든 맛집 !! 재방문의사 10000% 돔베고기 꼭드세요."
한라당몰국수,,케세라줌마3,2.26.목,고기국수를 먹었어요 김치와 깍두기가 너무 맛있어서 고기국수와 같이 먹기 좋았어요 멸치국수는 매콤하니 참고하시길
한라당몰국수,,endless86,2.22.일,돔베고기짱!! 너무 맛있어서 다시 찾았네요. 어쩜 그리 잘 삼으셨는지 배우고싶네요. 또 먹으러 올게요. ^^
한라당몰국수,,제주하나쌤,2.15.일,"한라 당몰 국수는 이번이 두번째 방문이에요.. 올레길을 걸으려고 작년 추석에 왔었는데.. 추석 당일이라 문 연곳이 없어서 우연히 찾게 되었었는데 유명한 집이라는걸 가게에 와서 알았다는요... 친절하신 사장님이 올레길 걸을거라고 추석 당일이라 과일을 챙겨 주셨던 기억이 나요.. 이번에는 설날에 올레길을 걸으러 한림쪽을 찾았는데 저녁 식사로 순대국을 먹으러 왔지요... 라스트 오더 직전에 가서 못 먹을줄 알았는데.. 다행이 든든하게 먹고 와서 너무 좋았다는요... 여기는 문앞에 고양이들도 귀여운 곳이에요... 설날에는 바람이 심하게 불어서 올레길을 걷지 못해서 다음번에도 갈 예정인데 그때도 재방문 할 예정이에요^^국수도 맛있고 수육도 맛있다는데 저는 여기 순대 국밥 진짜 맛있어요... 9,000원의 행복이랍니다"
한라당몰국수,,랑랑이215,1.27.화,넘 맛나고 다들 친절하시고 넘 만족해요 ( ͡° ͜ʖ ͡°) 제주도 오면 또 방문하고 싶은 식당입니다
한라당몰국수,,전설되고픈 중수 용구,1.24.토,야들야들 돔베고기 수육과 고기귝슈.. 제주 오면 꼭 먹어야죠 헤헤 감사히 잘 무써요.. 뭉텅뭉텅 썬 고기 식감이 참 좋아용
한라당몰국수,,시냇가에 심은 나무37,25.12.29.월,국물이 느끼하지 않고 맛있어요. 원래 국물 안먹는 스타일인데 여기는 국물까지 다 먹었네요. 담에 제주가면 다시 가고 싶은 곳이에요.
한라당몰국수,,맛집찾아다녀요,25.12.22.월,와 고기국수 진짜 맛있어요. 면발도그런데 큰 고기가 일곱점?은 들어있나봐요 엄청 야들야들... 심지어 구천원이에요
한라당몰국수,,정유어멈,25.11.13.목,고기국수 비빔국수 맛있네요 추천해요
한라당몰국수,,djwofogk,25.10.25.토,고기국수랑 돔베고기(소) 먹었어요 모두 친절하시고 김치랑 열무김치도 맛있어요!
우호적무관심,,진톨톨이,1.4.일,사진에 다 담지 못했지만 구조가 독특하고 건물 인테리어가 아름다워요. 한적한 느낌이 마음에 쉼을 줍니다. 크림슈페너 선택은 완전 성공적! 입에 폭신하게 담기는 크림과 크림아래 커피가 잘 어우러져서 진짜 맛있었어요. 여행 끝나고도 계속 생각나는 것 중 하나입니다.
우호적무관심,,UP,25.7.4.금,주차하기 편하고 가을에는 팜파스도 이쁜집이예요! 아이스라떼가 진해요 사장님 무서운 🐝 금방 처리해주셨어요
우호적무관심,,유영829,25.6.27.금,저지리 예술마을에 어울리게 건물도 멋스럽고 분위기도 좋아요 커피랑 브라우니도 맛나요♡
우호적무관심,,ekthadl502,25.6.14.토,라운딩 가기 전 괜찮은 카페 찾다가 찾은 곳이에요! 푸릇푸릇하고 사장님도 친절하세요 💖
우호적무관심,,dkg****,25.6.14.토,당근주스가 진짜 찐 당근입니다!! 건강에 좋을 것 같아요💛
우호적무관심,,NamooYa,25.6.11.수,"구좌 당근주스에 이끌려, 현대미술관을 갔다가 들렸어요! 인테리어도 멋지고 무엇보다도 화장실 앞 세면대 뷰가 믿기지 않을정도로 너무 멋있고 예뻤습니다! 다음 일정 때문에 음료만 사들고 갔지만 오래 앉아 책 읽고싶은 정말 기분 좋은 카페였어요. 그리고 당근 주스도 정말 상쾌하고 맛있었습니다!"
우호적무관심,,소소한 행복4171,25.6.8.일,사장님도 친절하시고 조용하고 깔끔해요~ 인테리어가 멋져요
우호적무관심,,슈슈4844,25.6.7.토,급작스럽게 비가 와서 실내에서 쾌적하게 책 읽으려고 왔는데 통유리에 비내리는 모습 보면서 앉아있으니까 너무 좋아요!
우호적무관심,,Katie21,25.6.6.금,제주스럽고 풍경과 건물이 어울러지는 멋진 카페💕
우호적무관심,,푸른곰팡2,25.6.6.금,당근주스가 맛있어요. 인테리어가 미술관다와요.
내가여기서이걸할줄몰랐다2,,나진영98,4.21.화,숙소 근처에 있어 점심에방문했는데 앞에 바로 바다라 분위기도 너무 좋고 음식도 너무 맛있어요 해물도 되게 많이 들어 있어서 배부르게 잘 먹었습니다!!
내가여기서이걸할줄몰랐다2,,jogarden,4.21.화,바다바로앞에서 식사할수있어서 너무 좋았고 무엇보다 재료가 신선하고 맛있습니다 잘먹고 좋은 시간 보내다 갑니다~~
내가여기서이걸할줄몰랐다2,,샤브샤브844,4.21.화,바다를 보면서 먹는 해물라면 꿀맛이에요 메뉴를 다양하게 시켜봤는데 다 맛있더라구오 이모님이 음식솜씨가 좋으세요 ^^ 화요일에 휴무인곳이 많은데 여기는 열어서 다행이에요! 잘먹고갑니당
내가여기서이걸할줄몰랐다2,,dlt****,4.18.토,보기부터 너무 맛있어보여서 바로 방문했는데 역시나 너무나 맛있었습니다 사장님도 너무 친절하시고 기분 좋은 여행이 될거같습니다 꼭 오십쇼 !!!
내가여기서이걸할줄몰랐다2,,cky****,4.13.월,매장도 깔끔하고 음식도 금방 나오고 사장님이 친절합니다!! 문어라면에 문어도 엄청 통통하고 임산부인 저도 맛있게 잘 먹었습니다!!👏🏻👏🏻
내가여기서이걸할줄몰랐다2,,gil****,4.13.월,음식가격도 합리적이고 신창풍차해안 바로 옆이어서 바다산책도 할 수 있습니다!^^
내가여기서이걸할줄몰랐다2,,leech1126,4.3.금,걷다가 찾은곳인데 사장님도 친절하시고 너무 맛있어요 최고
내가여기서이걸할줄몰랐다2,,juslie,3.21.토,맛있고 뷰도 좋고 너무 만족합니당 갑자기 배고파서 들어왔는데 ㅎㅎ 잘 먹고 갑니당
내가여기서이걸할줄몰랐다2,,영암32,3.17.화,뷰도 좋고 음식도 맛있어용
내가여기서이걸할줄몰랐다2,,밍밍1569,3.16.월,맛잇어요 !!!! 해장용으로도 좋아욧 👍👍 게다가 뷰까지 ㅋㅋ
찰리아저씨맛집,장소 찾기 실패,해당 없음,해당 없음,해당 없음
사이,장소 찾기 실패,해당 없음,해당 없음,해당 없음
그린사이공,,yyy49,2.11.수,사장님이 친절하시고 음식도 맛있어요🤍🤍 완전 추천합니다! 쌀국수 좋아해서 자주 올게요🙏
그린사이공,,skheo0211,2.11.수,여행 중 들렀는데 양도 많고 사장님도 매우 친절하세요! 제주 서쪽 여행하면 꼭 들러보길 추천합니다
그린사이공,,너무느린아줌마,1.31.토,너무너무 반미가 먹고싶어서 방문했어요 맛있게 잘 먹었습니다
그린사이공,,mar****,1.20.화,"매장에서 쌀국수 한그릇씩 먹고, 반미 맛집인듯해서 포장해와서 먹었어요~ 쌀국수 좋아하시면 한번쯤 올만해요~^^"
그린사이공,,너무느린아줌마,25.12.31.수,오랫만에 방문했는데 여전히 맛나요 친절하시고 고수는 이제 메뉴주문하면서 추가하셔야합니다
그린사이공,,jhr99116,25.11.29.토,너무너무 맛있게 먹었어요 혼자서 쌀국수에 반미에 짜조까지 푸파
그린사이공,,도로시2,25.11.13.목,"반비,쌀국수 맛있게 먹었어요 특히 바게트빵이 아주 맛있어요😋"
그린사이공,,지우짱69,25.11.10.월,굿
그린사이공,,sou****,25.10.14.화,진작에 아는 사장님한테 추천 받았는데 이제야 온것이 아쉬운 맛 쌀국수 국물이며 올라간 고기도 푸짐하고 맛있고 껌승(숯불고기 간장밥 ㅎㅎ)은 한국인 이라면 누구나 좋아할 맛 베스트 메뉴인 반미는 아껴두었다 곧 다시 와서 먹기로~♡잘왔다!!!!
그린사이공,,얌욤얌얌욤욤,25.9.23.화,"제주 서쪽 필수 코스 입니다 .. 💚🌿 제 인생 반미입니다 !!!! 저번 제주 갔을 때 이틀 연속 갔는데,, 이번에는 서쪽 못 갈 줄 알고 레드 사이공 가서 반미 먹어뒀는데 기회가 되어 이번 여행에 2번 먹었습니다 🤭 다 맛있는데, 그 중 제일은 반미 ෆ˙ᵕ˙ෆ"
