Search_Query,Place_Name,Nickname,Date,Review_Content
제주전복치킨 제주신화월드본점,,js7****,3.22.일,"튀긴 전복이랑 맛있는 치킨이 생각나서 제주 서남부 올때마다 저녁 먹으러 가는 곳입니다. 누가봐도 깨끗한 기름에 적당히 염지하고 속도 촉촉하게 치킨도 잘튀겨두시는데다가, 배고프지말라고 과자랑 라면 죽 등도 챙겨주십니다.(전 특히 죽이 맛있었네요)  5년전에 처음 갔던거 같은데 인플레이션으로 인한 가격상승 빼곤 분위기, 맛, 친절함 등은 변하지 않았습니다.  그냥 치킨도 비싸지 않게 파시는데, 기왕 여기 오신거 전복튀김도 소금에 살짝 찍어먹는게 좋지않나 싶어 전복치킨 시켜먹는게 좋지않을까싶네요"
제주전복치킨 제주신화월드본점,,HS PICK,3.6.금,신화월드 놀러와서 넘 좋은 리뷰보고 포장 방문한곳이에요 일단 사장님께서 너무친절하시고 서비스를 잘 챙겨주셨는데 치킨까지 맛있어서 너무 즐거운 저녁시간이 되었습니다 신화월드 또 오면 방문하고 싶을 정도로 강추해요!!!
제주전복치킨 제주신화월드본점,,스벅냅킨도둑,3.5.목,예전에 신화월드에서 시켜먹었다가 맛있어서 이번에는 직접 와봤어요 ㅋㅋㅋ 와서 먹으니까 더 맛있어요 진짜 양도 엄청 많아서 최고임
제주전복치킨 제주신화월드본점,,나만해요36,2.23.월,처음 먹어봤는데 너무 맛있어요 친절하시고 꼭 다시 놀러와서 뼈치킨도 먹고싶어요~아이들 때문에 순살 시켜먹었는데 너무 맛있어요 서비스로 주신 과자들과 전복죽도 대박입니다~꼭드셔보세요~
제주전복치킨 제주신화월드본점,,heygirl8712,2.21.토,여행 첫날 저녁으로 숙소에서 전복치킨 포장해서 먹었어요! 치킨외에 전복죽도 주시고 과자를 한봉다리주셔서 놀랐어요ㅎㅎ 전복튀김이 질기지않고 부드러워요. 전복 안먹는 아이도 튀긴 전복은 하나 다 먹어서 신기했어요. 후라이드 치킨이랑 양념맛도 좋아서 다음에 제주도 가면 또 먹고 싶어요!
제주전복치킨 제주신화월드본점,,kmh****,2.18.수,내용 없음
제주광추,,hsuyes,1.29.목,임신 6개월인데 싱싱한 회를 먹고 싶어 숙소 사장님의 추천으로 갔던 제주광추!! 이런 대광어를 처음 먹어보는데 보통 광어는 얇게 나오는데 여긴 두툼하고 정갈하고 비린내 없어서 실컷 먹었어요  회가 젤리 마냥 쫄깃쫄깃하고 같이 나온 곁들임 반찬....맛있어요 ㅠㅠ 회 한점에 술 한잔 해야하는데 까비! 다음에 출산하고 애기랑 갈게요!!!!
제주광추,,Patrick43,1.28.수,"엄청 친절하시고, 포장도 너무 섬세하게 해주셔서 감동이에요 ㅠㅠ 이렇게 하나하나 다 써주시다니 이렇게 친절한 가게 처음 봤어요 !! 번창하세요 감사합니다 💗"
제주광추,,dle****,1.10.토,너무 친절하고 너무 맛있어요 정말 강추입니다!
고바치,,mju****,3.25.수,늦은 점심을 위해 찾은 고바치 카페 역쒸 최고당~~~^^ 오늘같이 햇살 가득한 날씨에 딱 맞는 분위기에 크루와상 샌드위치와 아보카도&바나나 ... 넘 환상적인 조합이네ㅎㅎ 오늘은 고바치 카페 덕분에 최고의 컨디션으로 하루를 보낼수 있을거 같네~~~♡♡ 사랑해요~~~~ 고바치^^~
고바치,,MIIING,3.18.수,커피 맛집 & 뷰 맛집 & 사진 맛집  커피 진짜 맛있어요 ㅠㅠ 2층에서 보는 한라산뷰 정말 최고입니다 ! 막 찍어도 사진 무조건 잘 나옵니다 👍
고바치,,댕삼쀼,3.16.월,지나가다 들렸는데 인테리어도 너무 이쁘고 깔끔하네요! 음료도 넘 맛있어용!! 다음에는 커피 먹으러 올께용💜
고바치,,쇼비맙,2.24.화,제주살이 시작하자마자 바로 온 카페! 오랜만에 가도 조용하고 비가 와서 그런지 분위기가 더더 좋았어요! 뭐 마실지 고민하다 사장님이 추천한 카페 모카 마셨는데 정말 맛있었어요!! 브런치 냄새가 너무 좋아서 다음엔 브런치 먹어봐야 겠어요!!
고바치,,mju****,2.19.목,매번 올때마다 브런치 즐기기 너무 좋네요 . 햇살이 잘 들어와서 사진찍기도 좋습니다 말차라떼를 항상 테이크아웃을 하는데 진짜 맛있어용
고바치,,보일먼,2.9.월,"음식 맛있고, 조용하고 화장실 깨끗하고 사장님 친절하셔용 ⭐️⭐️⭐️⭐️⭐️"
고바치,,쿄우쿄우,2.1.일,분위기 좋아요 🎶 아메리카노 산미없고 맛있어요 !! 강아지도 넘 귀엽답니당 딸기라떼는 엄청 달지 않아서 맛있어요
빽다방 제주한경면수월봉점,,hyerenia33,3.3.화,당근
빽다방 제주한경면수월봉점,,내사랑규야29,3.1.일,저녁엔 비올꺼라.. 조금 일찍 밥먹고 집을 나섰네요.. 집근처 유일한 커피맛집^^ 식후엔 얼음박박 갈아서.. 커피 말아야죠^^ 소화도 잘되고 속이 뻥 뚫리는 듯해요.. 주유하고 해안도로 타고 드라이브 갈꺼라.. 들렸습니다^^ 커피는 빽카페예요~
빽다방 제주한경면수월봉점,,바닐라라떼라면,2.25.수,제주 시골에서 빽다방을 가다니... 넘 좋았어요. 마을에서 떨어진 곳에 있어 차타고 갔어요
빽다방 제주한경면수월봉점,,비밀이야7733,2.20.금,ㅁ
빽다방 제주한경면수월봉점,,미이식가,2.16.월,사장님 엄청 친절하세요~^^ 그리고 근처 올때마다 테이크아웃으로 자주 먹는데 늘 음료 맛있고 빨리 나와서 좋습니다!!!👍👍👍
빽다방 제주한경면수월봉점,,내사랑규야29,2.8.일,생일선물 받은 빽깊티 사용하러^^ 유용하네요 아쥬~ 커피 말아서 옹포로 배달갑니다.. 오늘도 레드향 발주에 정신없는 오빠님께~ 난 참 착한 동생ㅋ 고산서 옹포까지 커피배달을~ 사실 우리도 무늬오징어 팔러가는길 겸사겸사.. 빈손으로 가긴 글코.. 겨울이라 얼음 박박 갈은게.. 쉽사리 안녹아요ㅋ 장거리 배달 딱입니다~ 추워도 얼음박박 갈아야 좋드라그요.. 속이 뻥 뚫리는 맛^^ 오늘은 새로운 알바님도 계시네요.. 차분하니 천천히 해주셨어요.. 스탬프도 챙겨주시드라그요.. 오늘은 주인이모도 함께 주시니.. 주문 끝나고 나니.. 옆에서 커피는 이미 다 만들어져 나옴ㅋ 역시.. 매장 아담해도 두명은 일해야.. 손님이 편한거 같아요~ 시간은 금이니까^^ 감사합니다~ 눈발 날리는 수월봉뷰도 좋았어요~
빽다방 제주한경면수월봉점,,두아이아빠1,1.24.토,잘먹었습니다
빽다방 제주한경면수월봉점,,킬러메이커,1.18.일,좋아요
혼디인2714 감귤체험카페,,핑구7190,4.5.일,지나가다 우연히 발견한 예쁜 카페! 아늑하고 사장님이 친절해요~
혼디인2714 감귤체험카페,,으으으음45,3.6.금,하.. 진짜 엉터리 두쫀쿠 먹고 화났었는데 여기 두쫀쿠 진짜 개맛있내요...... 너무 달지도 않고 안에 스프레스 촉촉하니 바삭하고.. 피 적당히 얇아서 딱 좋아요. 여러분 여기 두쫀쿠 꼭 드셔보새요ㅠㅠ 개맛있음...
혼디인2714 감귤체험카페,,두팔쓰,3.2.월,두번째 방문입니다! 카페도 너무 이쁜데 체험도 할 수 있어서 좋아요!  저번엔 귤따기 시즌에 왔는데 이번엔 천혜향 시즌 때 오게 됐네요!!  넘 좋아요 ㅎㅎ
혼디인2714 감귤체험카페,,댕댕277,2.28.토,커피도 너무 맛있고 뷰도 정말 예뻐요💓 아이랑 같이 귤체험하기도 좋은 것 같아요🧡
혼디인2714 감귤체험카페,,유지2761,2.28.토,웰컴투 삼달리 촬영장소더라구요. 찾아가는 길은 멀었지만 음료도 맛있고 디저트도 굿. 사진 이쁘게 나와요.
혼디인2714 감귤체험카페,,꽃상점 일월화,2.28.토,"차도 맛있고, 뷰도 좋고, 웰컴투 삼달리 촬영지네요. 모두들 한번 오세요.^^"
혼디인2714 감귤체험카페,,카프카 맛집탐방,2.28.토,조용하고 분위기 좋은 카페
혼디인2714 감귤체험카페,,yj4****,2.25.수,아이와 여행와서 천혜향 따기 체험도하고 커피에디저트까지너무맛있고 분위기도 너무좋네요^^
크래커스 한경점,,i loveat i,3.22.일,"오모.... 라떼아트... 캎치노아트 뭐에요ㅠ진촤아아아 우연히 발견한 커피맛집에 행복했다!!!! 바치케 레시피 개발은 필요해보입니다 😋🥲 뭔가 눅눅한 것 같은 크래커는 먹을 수록 매력이 터짐 적당한 친절함이 있는, 조수리 맛도리 카페💓"
클랭블루 제주,,키티5017,4.2.목,노을 뷰 맛집 멍때리기 좋아요👍 제주 말차라떼도 맛있어요
클랭블루 제주,,TAMBURINS,4.1.수,디저트가 많이 없어서 아쉬워요 뷰 너무 좋습니다 풍차해안도로
클랭블루 제주,,tjs****,3.28.토,검색하다가 찾게 되어 처음 와본 카페입니다 제주에 뷰 좋은 카페들은 워낙 많지만 여기도 뷰가 정말 좋네요 👍🏻 바다랑 풍력발전소랑 제주 돌담이 한번에 보여서 정말 제주 느낌이 물씬 나는 곳이에요 매장도 넓고 조용해서 좋았구요 2층은 작은 갤러리처럼 해놨는데 사진 찍기 좋았어요
클랭블루 제주,,Sallygogo,3.25.수,"커피, 음악, 바다와 노을 풍경까지 모든 것이 완벽하게 어우러져 여유와 따뜻함이 느껴지는 공간과 시간이었습니다!!! 몇번째 방문인지 기억해주신 사장님까지...다시 제주에 올때 꼭 다시 방문하고 싶은 곳, 계속 생각날것 같아요~😊👍"
클랭블루 제주,,초록뷰,2.28.토,도민 추천으로 방문 했는데 공간에 비해 좌석이 적고 사람이 적어서 여유로운 시간 보내고 왔습니다👍
클랭블루 제주,,JejuN깔깔마녀,2.23.월,"신창풍차해안도로의 상징적인 카페 클랭블루는 바다를 품은 거대한 통창 뷰가 압권이다. 갤러리처럼 정갈한 내부 공간은 2층의 '액자형 포토존'에서 절정을 이루며, 하얀 풍차와 푸른 수평선을 한눈에 담아낸다. 묵직한 바디감의 커피와 부드러운 크림 라떼는 이곳의 세련된 분위기와 잘 어우러진다. 제주의 서쪽 바다를 가장 우아하고 고요하게 감상할 수 있는 공간이다."
클랭블루 제주,,쮸꾸미한사발,2.18.수,제주에 오면 꼭 들리는곳 한적한니 여유를 느낄수 있어 너무너무 조아요. 바다 풍경
클랭블루 제주,,레이쳴,2.9.월,오션뷰가 예쁜 카페에요
클랭블루 제주,,푸크마미,1.31.토,신풍해안도로 바로앞이에요 우도땅콩라떼 아메리카노 땅콩쿠키 다 맛있어요 2025블루리본받은곳이고 바다뷰가 끝내줍니다
웨스트그라운드,,82y****,4.4.토,망고빙수와 아메리카노 맛있습니다. 고양이 들도 이쁘고 사진 찍기도 좋아요
웨스트그라운드,,해삐쮸20,4.2.목,"제주한림카페로 대추천.. 분위기가 정말 좋아요! 와플이랑 초당옥수수빵 강력추천 ♡̈ 시그니처 웨스트라떼도 진한 말차맛이 매력만점이에용 ! 카페가 크고, 분위기도 좋고, 귀여운 고양이들도 있어요. 온실 구경하기도 정말 좋습니다~~재방문의사 200%드는 제주도 서쪽 예쁜카페로 추천해용!!"
웨스트그라운드,,덩치맘jung,3.30.월,"주차하기 편하고 야외 유채꽃 너무 예쁘고 오픈전에 갔는데 사장님 친절하게 반겨주시고 말차라떼랑 티라미수 먹었는데 맛있어요~ㅎ 온실에 열대 야자수랑 식물,꽃들이 너무 예뻐서 감탄하며 사진 많이 찍었네요 귀여운 고양이들이 따라 다니며 재롱 부리고 힐링 잘 하고 갑니다~다음에 또 오고 싶어요^^"
웨스트그라운드,,11월 12일,3.28.토,"오늘부터 생망고 개시한다고 해서 왔습니다🥭 운이 좋았어요,, 맛도 좋아요😋 왕큰고양이와 수목원 그리고 유채꽃이 있어요,,,"
웨스트그라운드,,처음처럼79,2.19.목,"고양이들이 살고 있는 식물원 카페라서 아이와 방문했어요. 고양이들 너무 순하고 예쁘고, 식물원도 볼게 많아요. 있는 내내 좋았습니다. 또 오고 싶어요♡"
짚불도 제주판포점,,sky****,4.7.화,처음 방문햇는데 초벌이 되서 좋았어요 그리고 생맥주가 잇어서 좋아요
짚불도 제주판포점,,꿍둥이아빠,4.6.월,뷰가 좋고 짚불향 이 좋아요 술 종류가 많아서 좋아요ㅎㅎ
짚불도 제주판포점,,alf****,4.5.일,제주도 여행와서 검색하고 가게에 왔는데 보던 데로 뷰도 너무 좋고 직원분들도 친절하시고 모든 게 완벽한 것 같아요 !!
짚불도 제주판포점,,5월의 신부님,4.5.일,맛있어요~~
짚불도 제주판포점,,sweet9785,4.5.일,메가리조트 숙박후 항상 이용하는 짚불도. 남편도 좋아하는 짚불도. 고기도 넘맛잇어요.짚불향가득♡ 강추♡
짚불도 제주판포점,,황프로52,4.5.일,낚시후 늘 오는곳이에요 존맛♡♡♡♡ 단백질보충 ㄱㄱㄱㄱㄱ
짚불도 제주판포점,,jja****,4.5.일,낚시 후 방문한 집불도 맛있게 잘먹었어요
후우,,블랑키티,4.1.수,너무 우울해서 몽글한 수플레가 먹고싶었는데 딱 인근에 있었던 후우. 맛있다♡
후우,,Jeju arang,3.30.월,예쁘고 고급스러운 분위기의 카페 후우 원목이 주는 느낌이 참 멋지고 고급스러운 화장실까지 어느것 하나 소흘히 생각되지 않는 카페 냉동실에서 막 나온듯한 아포가토는 냉동 잔에 아이스크림을 듬뿍 넣고 안을 파서 에스프레소를 부었다. 아이디어👍
후우,,Jooa,3.7.토,"수플레 먹고 싶어서 찾아서 왔는데 인테리어가 우선 너무 좋고, 여긴 필터 커피더라구요 맛이랑 디카페인까지 4가지 종류가 있어서 선택해서 먹기도 너무 좋은 곳이에요  수플레를 루꼴라샐러드랑 구운버섯이랑 먹는데 이렇게 잘 어울리다니 중간에 약간 매콤한 살짝 있었는데 그게 질리지않게 해서 개인적으로 젤 좋았어요   자리도 넓게 배치되어있어서 개인이나 단체로 오기 좋습니다!"
후우,,쫑쫑이의 이쫑저쫑,2.18.수,"제주 한경면에 위치한 드립커피, 수플레 맛집입니다. 내부 인테리어도 아주 아늑하고 좋은 곳이었는데, 커피도 필터커피를 취급하고, 정말 맛있는 수플레 케이크도 판매하더라고요! 수플레는 너무너무 부드럽고 생과일, 카라멜코팅이 되어 있는 바나나와 아주 잘 어울렸습니다 :)"
후우,,M23이지,2.14.토,고산에 이런 곳이 !! 생겼다니요 보드러운 수플레도 수프도 비주얼처럼 맛도 근사했어요 아이없이 조용히 다시오고싶내요
후우,,어쩌다장미,1.23.금,"새해 첫날, 떠오르는 분위기와 음식이 제주 서쪽 신도리에 있는 수플레와 찐커피라니~🍮☕️ 사진만 봐도 그때 그 맛, 그 부드러움과 달콤함이 잊혀지지가 않아요. 글구 대접 받는 느낌으로 커피를 직접 내려 갖다주시니반할 수밖에요. 사장님 부부께서 매력적인 마술을 부리고 계신거 같았..🤭🤗  제주도민 추천이 정말 찐인거 아시죠? #제주카페 디따 많아도 커피도 찐! 특히 수플레와 소금빵🥐은 기본으로 테이블에 다 있더라구요~ #후우 카페만의 소금빵을 맛보진 못했지만, 시그니처예요. 없어서 못먹었으니까ㅠㅠ  참고로 사진 찍으면 잘 나오기로 유명한데요~ 사람이 꽉차 테이블 만석이라 구석구석 공간을 담지 못했어요. 야외공간도 있고(얼음날 빼고 환상), 실내 단체공간도 있어요. 저는 문앞에서만 남겼지만 담번엔 꼭 도전!^^v"
후우,,trip1108,1.17.토,"오후에 방문해 담백하고 고소한 소금빵과 크로와상에 고소 블렌드 원두로 에어로프레소 드립 주문했습니다. 마셔본 에어로프레소 드립 중 제일 맛있었고, 따듯하게 데워주신 빵은 아무 것도 추가하지 않아도 맛있었습니다. 편안하고 차분한 분위기도 좋았고, 혼자라 주문 못했지만 다음에는 수플레와 잠봉샌드위치도 꼭 먹어보고 싶습니다."
곡간,,치즈버찌,4.6.월,곡간 오고싶어서 제주도 왔습니다. 작년에 방문했을때 맛있는 음료와 멋진 내부에 반했던 기억에 또 방문했는데 여전히 너무 좋네요 귀엽고 시크한 고양이 재팥이도 보러 다들 놀러오세요 ㅎㅎ 제주여행 필수코스..
곡간,,가영4247,3.19.목,"정말 애정하는 공간. 맛있는 콩 디저트에 매번 깜짝 놀라고, 커피와 차도 정성들여 셀렉하신 게 느껴진다. 블루베리 크럼블 디저트에 엑설런트 아이스크림 하나 까서 올려주셨는데 그 부분에서 살짝 정신 부여잡음,, 은은한 단맛에 고소하고 바삭한 크럼블,, 블루베리 상큼하고 아이스크림 시원하고 극락 오가는 맛;; 군데군데 마음 가득 쓰신 것이 느껴져서 사장님과 대화하지 않아도 공간으로 환대받는 느낌. 아무튼 좋다. 왜 우리집이 곡간 앞이 아닌가,,, ㅠ 우리 집을 옮기고 싶을 정도."
곡간,,러블리꽁2881,3.15.일,동네 산책하면서 커피 한 잔💖 행복 그 자체!! 커피도 넘 맛있고 분위기도 아늑하고 사장님도 친절^^ 주말 아침 행복 스타트~~💖
곡간,,또이7670,3.11.수,자주 가는 신창면 카페. 곡파모는 처음 해봤는데 시간 가는 줄 모르고 편하게 떠들다 왔네요. 카페 상시 메뉴도 다 맛있는데 곡파모 메뉴는 곡파모에서만 먹을 수 있으니 더 맛있습니다. 아침부터 재팥씨와 함께 해서 기분이 더 좋았다네요 ㅎㅎ
곡간,,이두시기,3.4.수,"우연히 탐색한 동네에서 만난 곡간, 이번에는 곡파모(곡간파인모닝) 다녀왔어요. 인사이트 넘치는 사장님과의 대화로 감사한 인연들로 마음 가득채워 나섭니다. 또 봬요🙏🏻"
곡간,,app****,3.1.일,비건지향하는 저는 비건카페 비건음식점에 관심이 많아요 후무스를 좋아해서 찜콩해 두었는데 마침 지나가는 길이라 들렀어요 사장님 친절하시고 여행중이라 하나만 골랐는데 사장님께서 선물까지 챙겨 주셔서 감동 받았어요 후무스가 냉동 상태라 숙소와서 살포시 맛만 보았는데 깔끔하고 담백하고 맛있어요
곡간,,레이첼78,2.19.목,카페가 아늑하고 귀여운 고양이도 있고 음료도 맛있어요 잘 쉬다 갑니다
곡간,,illiiiliillli,2.16.월,친절하고 후무스와 커피가 맛난곳 고양이 애교많음ㅎㅎㅎㅎ 리뷰이벵으로 받은 콩낭시에도 맛나요 여행 아침에 간단하게 들려서 커피한잔하기 좋은곳입니다
서리논식당,,바기슬슬,4.8.수,"숙소 근처 오가며 보다가 한번 가봐야겠다 싶어서 오픈런 했습니다. 일단 다 필요없이 동네 식당인데, 정말 청결하고 정갈하고 깔끔합니다! 2명이서 몸국과 서리논밥상을 시켰는데 음식사진이 없는 이유는 맛보자마자 이거다 싶어서 순식간에 해치웠기 때문이에요😅 웃으며 맞이해준 사장님과 정말정말 깨끗한 주방과 말한마디 없이 순삭하게 만든 반찬과 음식들, 그리고 유채꽃이 넘실대던 창밖풍경까지💗💗 여행 끝나도 계속 생각날거 같아요! 자진해서 솔직한 리뷰 남겨봅니다"
서리논식당,,hea1****,4.4.토,몸국이 맛있다고해서 일부러 먹으러 왔어요. 진짜 맛있네요.
서리논식당,,마거리트10,3.26.목,옥돔구이도 나오고 인당 만원에 반찬 고기까지 고루나오고 국도 주시고 구성이 아주좋습니다 친절하시고 음식도 빨리나왔어요~ 제주도 현지분들이 많이 찾으시는식당인것 같았어요. 아이랑갔는데 아이먹으라고 귤도 주셔서 감사했습니다~~
서리논식당,,Poko7,3.25.수,몸국 고소하니 맛있어요 잘먹었네요.
서리논식당,,ftt****,3.22.일,검색해서 가까운 곳으로 간 식당이였는데 너무 맛있게 잘먹고 나왔습니다. 몸국이 정말 맛있었습니다^^
서리논식당,,우리릴리,3.19.목,처음 방문했는데 주차장이 넓어서 주차하기도 편해서 좋아요 그리고 반찬 가짓수도 정말 다양하고 음식이 정말 맛있어요 사장님 손이 크신지 반찬 양들도 엄청 많네요 아이도 한그릇 그냥 미역국에 말아서 먹었어요 김치찌개랑 밥상 시켰는데 2인분 양이 아닌듯 가성비 최고의 맛집^^
서리논식당,,zzxakzz48,3.18.수,"친구들이랑 게스트하우스 가기전 드라이브 하다 발견 !!  평소 도전을 좋아하는 저는 해물뚝배기가 아닌 제주 몸국을 먹어보기로 했어요 ~~  처음보는 비주얼에 잠깐 당황했지만 , 먹어보니 완전 맛있어요 !  해물뚝배기 시킨 친구들도 맛보더니 , 몸국 하나 추가 ! 해물뚝배기도 맛있지만 다들 몸국에 정신 팔려서 몸국을 먹더라구요  돌아가는날 또 방문 예정 ! 제주 여행 시작 완전 최고 ~~~"
용수씨,,밖만치,3.31.화,"제주 서쪽 여행 중이라면 조용하게 쉬어갈 수 있는 오션뷰 감성 카페로 한경면 용수리 카페 용수씨 추천! ✨️ 오션뷰도 넘나 예쁘고, 맛, 감성, 재미까지 다 갖춘 곳이라 저는 이미 또갈집으로 확정이에요~! 갓 만들어주신 콘치즈 토스트도 짱맛탱! 1인 카페라 손님이 많으면 살짝 기다림이 필요하지만 미니 포켓볼도 치고 바다멍 때리고 있으면 금방 나와요~~~~ 😋😋"
산노루 제주,,내일부터진짜다이어트,3.20.금,"휴무일을 기다려 드디어 왔지만 디저트가 엄서서 아수웟댜,,,, 흑임자 크림 말차 라떼 꼭 드세요🍃"
산노루 제주,,앤0281,2.18.수,"말차러버라면 한번은 들러봐야 할 곳 여유로운 분위기와 깔끔하고 향긋한 말차, 호지차 너무 맛있어서 세작이랑 말차생초콜릿도 추가해서 먹었어요."
산노루 제주,,하늘바라기911,2.15.일,말차 좋아하는데 두유 옵션이 있어서 갔어요! 근데 두유대신 오트로 바뀐거 같아요 말차음료/디저트와 호지차 음료도 종류가 다양해서 좋네요 말차도 맛있고 호지라떼도 구수하고 풍미가 깊은게 맛있었어요😋
카페 온결,,vronica,4.5.일,such a cute cafe!!!!! its right by the sea so i visited by accident and it was so nice!!! you cant see the sea from the cafe but you can see the windmills and its so beautiful!!!
카페 온결,,아리보라63,4.4.토,지나가는 길에 아메리카노 먹고싶어서 들렀는데 커피도 맛있도 아몬드쿠키가 진짜 짱 맛있습니당!!!! 매장이 곳곳이 그림같이 예뻐서 더 머물고 싶은 곳이었어요! 추천👍🏻
카페 온결,,맘엔마미,3.28.토,공항가는길에 들른 커피숍. 분위기에 취해서 집에 못갈뻔했어요. 친절하게 반겨주셔서 감사합니다!
카페 온결,,뇨뇨뇨뇨니,3.26.목,해가 질랑말랑 할 때 오는 카페 온결은 언제나 옳다!! 햇빛이 촤르르 하고 들어와서 너무 따수워요!! 제 최애는 브로콜리스프🥦
카페 온결,,예리노,3.20.금,"제주도에서 조용히 힐링하고 싶다면 카페온결 추천해요 ☕️ 우드톤 인테리어가 따뜻하고 정갈해서 들어가자마자 편안한 느낌이 들었어요.  아이스커피는 깔끔하고 산미가 과하지 않아 부담 없이 마시기 좋았고, 함께 시킨 떡과 꿀 조합이 정말 잘 어울려서 간단한 디저트로 딱이었습니다. 플레이팅도 깔끔해서 사진 찍기에도 좋았어요.  전체적으로 분위기가 차분해서 혼자 시간 보내기에도 좋고, 여유롭게 쉬다 가기 좋은 공간이에요. 재방문 의사 있습니다 🙂"
카페 온결,,애월뽀로롱,3.11.수,시그니처만 주문했는데 너무 맛있어요. 매장도 넓고 아늑하고 깨끗하고 좋아요. 강추입니다.
카페 온결,,hzzz22,3.8.일,제주 서쪽에서 지내는 동안 자주가는 카페. 판포포구 근처에서 커피맛이나 분위기 생각했을 때 가장 만족스러운 곳. 요즘 꽂힌 아인슈페너와 최애 간식 초코쿠키로 당충전하며 개인 작업하기 좋았고 아인슈페너에 올라가는 크림 너무 맛있어요🤩
카페 온결,,호야6424,2.28.토,우연히 들린카페인데 너무이쁘고 사장님도 친절하세요! 다음엔 머물다갈게요^^
카페 온결,,소소한결,2.12.목,"신창해안도로 드라이브 하고 협제 가는 길에 가족, 커플이 들리기 좋은 분위기 좋은 카페입니다. 브로콜리스프랑 감자스프가 있는데요 오전에 따뜻하고 든든하게 한끼 해결할 수도 있습니다. 귤쨈도 맛있어요. 가래떡 구이도..... :)"
카페 온결,,이채연373,2.12.목,길가다가 우연히 발견한 카페인데 너무 잘 들어온 것 같아요!! 책방같은 분위기도 너무 좋고 뷰가 좋아요 통창이 꼭 갤러리에 온 것 같은 느낌을 줘요 편안한 분위기의 공간에서 여유를 느끼고 싶은 분들에게 추천해요
