Search_Query,Place_Name,Nickname,Date,Review_Content
하소로커피,,Cloud9996,4.3.금,"☕ 제주 조수리에서 만난 인생 커피, '하소로 커피'  제주 서쪽 조용한 마을 조수리에서 정말 제대로 된 로스터리 카페를 발견했어요! 공간이 주는 차분함 덕분에 여행 중 잠시 쉬어가기 딱 좋은 곳입니다.  1. 🌿 조용하고 감각적인 분위기 마을 풍경과 어우러진 카페 외관부터 내부의 감각적인 인테리어까지, 제주만의 여유로움이 가득 느껴집니다. 혼자 방문해서 창밖을 보며 커피 한 잔의 여유를 즐기기에 이보다 더 좋을 수 없더라고요.  2. ☕ 특별한 아메리카노 이곳의 아메리카노(특별한)를 마셔봤는데, 정말 이름 그대로 '특별'합니다. 기분 좋은 산미와 깔끔한 뒷맛이 입안을 산뜻하게 해줘요. 로스팅 실력이 대단하시다는 게 한 입 마시자마자 느껴집니다!  제주의 진정한 커피 맛집! 하소로 커피, 재방문 의사200%"
하소로커피,,깽이5548,4.2.목,"(200% 내돈내산 리뷰입니다) 지난 여행 때 마신 커피 맛이 잊혀지지않아서 다시 방문했어요! 여행 경로에서 벗어나도 찾아갈만큼 여전히 맛있네요~! “맛있는” 커피를 좋아해서 여기저기 찾아자니는데, 하소로 커피는 그중 탑입니다..  다양한 원두 중에서 고르는 재미도 있고 다 맛있어서 줄어드는 걸 아쉬워하면서 먹었네요 ㅎㅎ (자칭) 커피 박사. 엄마도 황홀하다고 하셨어요 ~!  오래오래 장사해주세요~~!"
하소로커피,,adorablekiki,3.29.일,"오늘 아아는 특별한, 강력한 두 가지 다 크게 맛있게 느껴지지 않았어요. 조수리가 달콤해서 그런가? 디저트 좋아해서 빵 잘 나오는 카페 좋아하는데 여긴 스콘이 메인이고 (딱 한 번 먹어봤는데 쏘쏘) 바치케는 너무 맛없게 생겨서 패스.. 냥이 너무 귀여워서 힐링했어요"
하소로커피,,호기심만땅소녀,3.1.일,"기대가컸는지 살짝실망감 ㅜ 블랜딩 아메리카노마셨는데맛이 무난했어요. 공간은차분하고 포근해요. 스콘이디저트인데 버터의깊고고소한 풍미보다약간 오일리한향이더나서 제취향이아니었고,  2층복층자리가하나있는데 나름주변에서어슬렁거리며노렸는데 앉으신분이한시이넘게안나가시네요 ㅋ 저와같은마음이었나봐요 ㅋㅋ 다음에기회되면 핸드드립으로마셔보고싶어요."
하소로커피,,봉순냥이,2.27.금,"카페 분위기도 좋고, 커피도 맛있어요. 스콘도 맛있게 먹었어요. 드립백과 원두도 판매해서 원두도 사왔어요. 창가쪽 자리엔 읽을만 한 책들이 제법 있어서 책 읽기도 좋아요. 그리고 고양이 소로가 귀여워요:)"
하소로커피,,미이식가,2.16.월,커피 원두 신선해서 자주 이용합니다~^^
모살왓가든,,ouruni,3.14.토,내용 없음
모살왓가든,,달이 차오른다 가자,3.10.화,"자투리는 1인 200g인데 2인분 해서 300g이 안될 것 같습니다. 고기는 맛있었어요. 톳돌솥밥은 오천원인데, 톳이 최소 3일은 된 것 같아요. 식감과 향이 떨어집니다. 된장찌개는 3천원인데, 색과 맛이 된장찌개 색이 아니에요. 밑반찬은 다양하게 나옵니다. 장아찌가 맛있습니다. 톳 반찬과 콩나물무침은 만든지 오래됐어요 ㅜ"
모살왓가든,,omj****,2.12.목,음식이 맛있어요~
모살왓가든,,ㅁ네모,1.27.화,2명이서 흑돼지모듬 2인 주문했어요 양이 적지 않아서 배부르게 먹었습니다~ 계란찜도 안에 파가 들어있으니 맛있어요 상추도 싱싱하고 파절이도 맛있습니다
모살왓가든,,하랑아범65,1.8.목,현지인 맛집이에요 근처 펜션 사장님 소개로 왔는데 칠돈가 같은 맛과는 좀 다르네요. 현지인 맛집이고 반찬은 직접해주신것들이라 기성품 아니어서 좋았어요~~ 직원기타 사장님까지 중국분들 같은데 희안하게 친절합니다 ㅋㅋㅋㅋㅋㅋㅋ~~~ 찌개부터 고기까지 로컬틱하지만 퀄리티 매우좋고 셀프바 잘 되어있어 반찬 알아서 갖다먹기 편하네요~~^^
명리동식당 본점,,별달집사,4.2.목,생각보다 웨이팅 금방 빠지고 맛은 흠잡을 곳 없이 좋았어요.. 많이 바쁘신 것 같긴해요 T-T
명리동식당 본점,,lee****,3.29.일,너무급히 먹는바람에 사진을못찍엇음요~ 10년전부터 1년에한번은꼭들리는 식당 사장님한결같으시고 고기질 한결같고 고기가성비 금액 변함없고 제주도 오시면 꼭한번 들릴만한 고기집입니다 완전강추 사이다 콜라 서비스감사했습니다 ^^ 번창하세요~
명리동식당 본점,,맘엔마미,3.25.수,맛있어요
명리동식당 본점,,kanta89,3.21.토,연탄불에 구워서 그런지 고기가 더 맛있음
명리동식당 본점,,Suvely2,3.1.일,가성비 좋고 맛나요 잘먹었습니다!
명리동식당 본점,,jjgongju1118,2.27.금,"자투리 고기와 김치전골 꼭 드셔보세요! 너무 맛있어요:) 직접 구워주셔서 식사도 편안하게 했고, 주차장도 따로 마련되어 있어서 좋았어요~"
명리동식당 본점,,joo****,2.26.목,소문듣고 왔는데 식감좋은 짜투리고기조 맛있고 목살도 단백하고 김치찌개도 진짜 좋아요. 재방문 의사 100%입니다~ 여행와서 잘~~~먹고 가요!
명리동식당 본점,,푸른산하,2.7.토,제주에 오면 늘 방문합니다. 10년전에도 오늘도~~ 평소에 먹던 퍽퍽한 목살이 아닌 부드러운 목살~ 오늘도 맛나게 먹고 갑니다.
한경가든,,영재공인,4.7.화,1. 현지인 인정 로컬맛집 오래된 내공 느껴졌음 재방문 많은 이유 있었음 찐로컬맛집분위기 2. 생물 갈치조림 깊은 맛 부드러운 살과 진한 양념 조화 뛰어났음 밥도둑 느낌 있었음 깊은맛갈치조림 3. 정성 가득한 반찬 구성 반찬 하나하나 손맛 느껴졌음 전체 밸런스 좋았음 정성가득한한상  #제주한경면맛집 #제주로컬맛집 #고산리맛집 #제주서쪽갈치조림 #수월봉맛집  https://blog.naver.com/hihjk21/224246148647
한경가든,,mizra39,4.7.화,내용 없음
한경가든,,22소댕22,4.6.월,순살 갈치조림이라 먹기 편하고 매콤한 양념이 자극적이지 않고 맛있었어요 밑반찬도 매우 깔끔하고 정갈해서 집밥 느낌나는 집이었답니다:)
올레집,,drchuuk,3.19.목,올레길 14코스 걷기 위해 도착한 곳에서 발견한 식당이다. 원래 10시 오픈인데 그날 도착하니 문이 열려있다. 동네분이 오셔서 일찍 열었다고 한다 찐 동네 맛집이다. 순대국 든든히 먹고 14코스 20km정도를 가뿐하게 완주했다.
올레집,,조아짱20,2.2.월,3년전 올레길 걷다가 맛본 순대국밥 너무 맛있어서 다시 찾아왔네요 여전히 신선하고 깔끔하고 냄새가 나지않아 맛있게 먹고 가네요
올레집,,메멘토57,1.24.토,"점성있는 몸국만 먹어봤는데, 여긴 맑은 몸국입니다. 반찬도 맛있고, 올레길 걷고 식사하기 딱 좋은곳입니다"
즈물,,풀65,4.1.수,내용 없음
즈물,,ovo****,3.27.금,우연히 왔는데 고즈넉 도라방스.. 즈물라떼랑 한라산 케이크 너무 취저입니다 한적하고 따듯해서 잘 쉬다갑니다
즈물,,제주인플루엔자,3.17.화,여기 너무 예쁜데요. 사장님이 남자분인데 미적 감각이 대박입니다. 특히나 동자석 모양으로 파운드를 만드는데 완전 졸귀탱이네요. 먹기가 아까울 정도입니다. 카페 내부가 너무 예쁘고 미술 작품도 전시되어 있어서 구경하는 재미가 쏠쏠합니다. 파운드도 상당히 맛있고 전반적으로 만족도가 높았습니다. 여행객분들 기념품 고르기 어려우실텐데 동자석 파운드 사가보세요. 지인들이 다 좋아할 것 같아요. 한경 카페를 찾는 분들은 꼭 가보시길 바랍니다!!!
즈물,,yjc****,3.10.화,"제주 여행 중 외관의 커다란 빨간 리본에 이끌려 들어간 '즈물'! 선물 상자 같은 인테리어부터 기분이 좋아지는 곳이었어요. 🎁 가장 기대했던 한라산 케이크 소금우유맛은 정말 감동이었어요! 한라산을 형상화한 비주얼도 너무 멋진데, 한 입 먹자마자 느껴지는 짭조름하면서도 고소한 우유 풍미가 일품입니다.🥛✨ 무엇보다 좋았던 점은 커피 원두를 고소한 맛과 산미 있는 맛 중 선택할 수 있다는 거예요! 취향에 맞게 고소한 원두로 골랐는데, 진하고 묵직한 바디감이 달콤한 디저트와 찰떡궁합이었습니다. ☕️ 귀여운 목도리를 두른 동자석 키링과 소품들도 너무 사랑스러워서 구경하다 보니 시간 가는 줄 몰랐네요. 제주 동쪽에서 특별한 디저트와 아늑한 분위기를 찾는다면 무조건 추천입니다. 👌"
즈물,,owen531,3.3.화,우연히 주변카페를 찾다가 여기를 왔는데 너무 잘왔다는 생각이 들었습니다. 동자석으로 표현한 파운드나 한라산 케이크가 너무 맘에 들구 무엇보다 가게 인테리어가 너무너무 맘에 들어서 꼭 여기는 혼자 책을 들고 다시 와보고싶은 곳이다라는 생각을 했습니다. 다음 제주도 여행에는 일정에 즈물을 넣어놓을려구요ㅎㅎ
빈BEAN2020,,괜찮아 잘될 거야,1.17.토,"차귀도를 바라보며 맛있는 커피를 마실 수 있는 카페라 추천 받아서 빈2020 카페에 방문했어요. 바다를 바라볼 수 있는 창가쪽 자리에 앉으니 따끈한 햇볕에 봄날 같아요. 시그니처 메뉴라 안내되어 있어서 빈스크림라떼 마셨는데, 컵 위로 가득 얹혀져 있는 크림이 엄청 부드럽고 달달하니 맛나네요. 아메리카노도 맛있어요. ^^ 루프탑에 올라가 바라본 차귀도 앞바다 풍경이 눈이 시원하고 멋져요."
웃뜨르항아리,,리뷰하는하마,3.15.일,전복칼국수랑 비빔밥 존맛👏🏻
웃뜨르항아리,,현재가미래를바꿈,3.13.금,오랜만에 재방문 메뉴마다 맛이 있었고 다시 찾아가게 된건 밑반찬이 맛있어서 생각났어요 근처 갈일 있으면 방문해보시길 추천드려요😀😀
웃뜨르항아리,,노른자동동,2.27.금,내용 없음
웃뜨르항아리,,win****,2.27.금,가족여행으로 방문한 제주에서 고소하고 깔끔한 보말칼국수와 고기국수를 먹을 수 있었어요 !! 아이들이 먹을 만한 비빔밥도 있어서 아이부터 부모님까지 함께 맛있게 먹을 수 있어요 ㅋ 주차장에는 닭이 방목되어있어서 아이들이 재밌어했어요 ㅋ
웃뜨르항아리,,두보레,2.17.화,리뷰평이 좋아서 빙문했는데 밋있게 잘 먹었습니다 엄청 친절하셨구요 3종류의 김치는 밥이 나오기전브터 먹어도 맛있었습니다 싹싹 다 먹고 나왔네요 마당뒤에 다양한 닭들도 있네요 ㅎㅎ
웃뜨르항아리,,새로운출발과 도전,2.16.월,맛있어요
웃뜨르항아리,,zus****,2.15.일,정말이지 인생 맛집입니다!! 원래 잘 안 그러는데 후기 써드리고 싶어서 영수증도 말씀 드려서 받았습니다!!  가려던 브런치 카페가 조기 마감되어 근처 국수집 검색해서 왔는데 생각지도 못하게 이번 3박4일 제주 여행간 먹은 곳 중 제일 맛있었습니다! 딸려오는 미역국도 기가 막히고 김치와 음식들 간에 궁합이 대박이에요 또 올게요~~😊 주차장에 있는 귀여운 닭들과 강아지들도 보며 힐링되고 김장하시는 모습도 힐링 그자체였어요 !
웃뜨르항아리,,비오는날의한국화,2.14.토,"이 지역 숨은 맛집이라고봐요 요 전날 보말칼국수 먹어보고 맛있어서 보말죽 포장해가서 아침식사로 아주 맛나게 먹었답니다 그러고나서 다시 방문해서 고기국수, 만두 먹어봤는데요 만두가 놀랍도록 감탄스러운 맛입니다 고기와 새우의 절묘한 만남 👍🏻 대체로 다 맛있어요"
웃뜨르항아리,,짤풀리는집,2.13.금,아침 일찍 갔더니 죽은 밥알이 살아있었어요 보말칼국수는 미역맛이 많이 나요 면은 굵습니다
웃뜨르항아리,,happymay0518,2.12.목,우연히발견한 완전 맛집 너무맛있어서 이집오려고 부모님 모시고 일부러 제주도 다시왔어요~ 보말칼국수 전복비빔밥 수육 김치3종류 엄청 맛있어요~~재료도 거의 국내산 쓰시는것같고 저한텐 인생맛집이였습니다~~
푸지그랑,,하루미 겸 다나,4.4.토,제주도 아침으로 먹었는데 특색있고 맛있습니다!
푸지그랑,,날밤까기,4.1.수,고사리해장국 좋아하는데 여긴 찐이네요. 메밀부침도 100% 메밀만 써서 뚝뚝 끊어지는게 맛있네요. 잘 먹었어요
푸지그랑,,백제강,3.31.화,내용 없음
푸지그랑,,jiyu7979,3.30.월,부모님과 함께 제주여행와서 우연히 들렸는뎅 숨은 맛집이에요~지짐이 사진은 못찍었는뎅 너무 맛있어요~갈치젓도 맛있어서 3개나 구입하고 갑니당~ 반찬 하나하나 다 맛있고 제주에서만 먹을수 있는 특식 같아요~사장님도 친절하시구 아버지와 기분 좋게 식사하고 나왔습니당~~🫶🏻 다음에 제주오면 또 들릴께용~ ♡
푸지그랑,,코드78,3.30.월,고사리 해장국 자극적이지않고 맛있었습니다 모멀놈삐국 다른 접짝뼈국집보다 담백하고 맛있어요 아침 먹기 좋은 집이에요
제주돗,,fly****,3.2.월,아이들 18개월때 왔다가 너무 좋았던 기억에 52개월 준 어린이가 되어 다시 방문한 제주돗. 고기도 너무 맛있었고 아이들끼리(with 사장님 딸) 즐거운 시간 보내서 더욱 귀한 시간이었어요. 다음 제주여행(아마 내년)에도 꼭 갈게요^^
금자매식당,,ojh2851,2.17.화,여행중 우연하게 들린곳 돌솥밥 전문점 ~맛이끝네준다.~^^ 오늘점심도 히트다~
금자매식당,,디이에이,2.15.일,"간이 세지 않고 깔끔해서 질리지 않아요. 그리고 식사가 늦게나와서 사장님이 서비스로 게장을 챙겨주셨는데, 웬만한 전문점보다 맛있어서 깜짝 놀랐어요. 인심에 감동했습니다. 많이 파세요!"
금자매식당,,수박박박수,2.10.화,부모님 모시고 다시 오고 싶은 식당이었어요~! 밑반찬도 맛있고 혼밥이었는데도 반찬도 너무 잘 챙겨주셔서 진짜 열심히 최선을 다해! 맛있게 먹고 나왔습니다😊
금자매식당,,무럭뽕,1.29.목,제주도에서 먹은집 중 일등이요~!! 웨이팅 있을까 계속 보고 갔는데 다행히 바로 들어갈수 있었어요~ 음식 반찬 정갈하고 최고! 금자매때문에 서쪽 다시 꼭 와야겠어요ㅎ
금자매식당,,lon****,1.25.일,제주도에서 먹은 식당중 밑반찬이 제일맛있어서 너무 기억에 남을것같아요 다음에 무조건 재방문할꺼에요!!!!!
금자매식당,,bowwow93,1.18.일,솥밥 먹고 싶어서 방문한 곳인데 전복솥밥도 맛있었지만 명란문어새우 솥밥이 너무 제스탈이었어요!!!!! 명란 들어가서 간도 짭짤하면서 문어는 하나도 안질기고 쫄깃하고 문어에서 나온 물이 밥에 우러나왔는지 살짝 붉은색으로 밥이 물들어있었는데 그거 덕분에 더 깊은 맛이 났던 것 같아요👍🏻👍🏻 고등어 구이도 같이 반찬으로 나왔는데 간도 딱 좋고 너무 담백하고 맛있어서 한그릇 뚝딱하고 배부르게 잘 먹고 왔어요~~~!!!
금자매식당,,citohan,1.16.금,아점으로 전복솥밥 먹으러 방문.전복밥에 전복이 가득하고 버터와 간장에 비벼 김에 싸 먹으면 아주 맛있어요.반찬들도 맛있고 깔끔 합니다.
재미제주,,rla****,4.5.일,제주 인생 맛집! 레몬파스타는 지금까지 먹는 레몬파스타 중 일등 ㅎㅎ 와사비 꼭 같이 드세요! 분위기도 좋고 친절하시고 또 올 듯
재미제주,,sta****,3.15.일,음식이 매우 짠편입니다. 리조또는 밥알이 덜익었다 싶을 정도로 밥알이 씹혀요. 두번은 안갈래요ㅠㅠ
밭담호박,,d0o0p,3.30.월,여기 카스테라호박인절미도 맛있고 약밥도 개별포장으로 구입할 수 있어서 너무좋아요 굳굳. 코코넛튀일 진짜 맛있음
밭담호박,,앙겔로스37,3.23.월,맛있어요
밭담호박,,pea****,3.10.화,진짜 맛있어요
밭담호박,,baebae61,2.24.화,숙소 근처라서 와봤는데 너무 맛있어서 리뷰 써요!!! 떡이 쫀득쫀득하고 적당히 달고 아무튼 맛있어요 기본 인절미만 사려다가 팥앙금 2개 더 샀는데 순삭했네욤 더 살 걸 그랬어요🤤 여자 사장님(?)도 너무 친절하시고 패키징도 귀여워서 좋은 기억으로 돌아가요ㅎㅎ 다음에 또 올게요
밭담호박,,Bok Ssil,2.18.수,저는 태교여행으로 와서 여미지 식물원에 갔다가 설이라구 밭담호박을 받았었는데요..! 너무 맛있어서 매장에 주문예약하고 찾아왔어요 😆💝 은은하고 달달한 이 인절미. 부드럽고 술술 넘어가네요. 제 취향은 은은한 쑥향이 맴도는 쑥이랑 호박!!!! 호박인절미 너무 맛있어요~~🤣 서울까지도 배송이되면 좋겠다는 개인적인 사심섞인 마음입니다..💦💦
밭담호박,,adorablekiki,2.16.월,집에서 냉동해놓고 먹을거랑 선물할 거 구매했어요 포장비 3천원 추가해 포장 선물받은 지인이 좋아했어요 큰 호박설기 처음 먹어보는데 중간에 꿀이 많이 달지 않고 시나몬향이 은은한게 역시 맛있네요 큰 덩어리로 살 걸 그랬어요
밭담호박,,다다3886,2.12.목,내용 없음
밭담호박,,ggobobang,2.11.수,"자극적이지 않고 은은한 단맛이라 아이들도 부담 없이 먹기 좋고, 부모님 선물용으로도 정말 좋은 곳이에요. 무엇보다 재료를 안심하고 먹을 수 있어서 더 마음에 들었습니다. 건강한 맛이라는 게 딱 어울리는 곳이에요. 특히 쑥인절미는 별미 그 자체! 쑥향이 진하게 퍼지면서도 질기지 않고 부드러워서 계속 손이 가는 맛이에요. 팥시루도 많이 달지 않고 담백해서 정말 맛있게 먹었어요. 팥 좋아하시는 분들은 꼭 드셔보세요 😊 건강한 간식, 선물용 떡 찾으신다면 추천합니다! 재방문 해서 또 사올려구요 👍"
밭담호박,,sunny91,1.27.화,"너무 맛있게 잘먹었습니다. 직원들이 떡이 너무 맛있다고 너무 좋아했어요! 직접 배달까지 해주시고, 감사합니다."
밭담호박,,안이곰,1.26.월,"너무 맛있어요!! 선물용으로 구매했는데, 사장님이 친절하게 포장도 잘해주시고 맛보기용으로도 먹어봤는데, 너무 맛있고 만족스러웠어요!!"
연리지 가든,,The Style Korea,3.7.토,한글 모르세요 못읽으세요. 이건 아닌 듯 해요. 어째근 잘먹었네요. 감사합니다
연리지 가든,,배부른춘식잉,2.3.화,"예약하고 방문했는데 취향과는 멀었던 곳입니다 매장이 작아서 몇 테이블 없었고 분위기도 다운되어 조용하게 식사하는 분위기예요  일단 불이 너무 약해서 고기가 잘 안익었습니다 겨우 데워지던 고기를 초벌이라고 다시 접시에 빼셨는데 어느 세월에 익을까해서 숯을 더 넣어달라고 요청했습니다 이제 속도에 맞게 초벌된 고기를 다시 구워먹으라고 하셨고 중간에 어슷썰기로 잘라주셨는데 맛이 없었어요  일하시는 분들께 뭔갈 요청해도 대답이 없으시고,, 매장에 있던 손님들도 즐거워 보이지가 않았어요 맛있고 기분 좋게 식사하실 분들께는 다른 곳을 찾아보시는걸 권유드립니다"
연리지 가든,,먹을때행복이,1.20.화,토종 흑돼지 맛있네요!!
양가형제,,맛을 찾는 사람,4.3.금,제주도에서 손꼽히는 수제 햄버거 맛집.. 햄버거에 스위스 치즈가 들어가고 육즙이 꽉차있습니다.  햄버거도 햄버거지만 양파튀김으로 유명한 곳이죠.. 굉장히 큰 양파를 통째로 튀김을 만드는데 양파와 튀김이 떨어지지않게 나오고 처음 뜨거울때 먹으니 불향도 느껴지고 굿입니다.  사장님이 가게와 버거에 프라이드가 가득하시고 열정이 있어보여 좋았습니다.
양가형제,,내가맛있다면맛있는줄알어,3.25.수,양파튀김 바로 먹으면 맛있고 햄버거는 워낙 맛있는곳이 많아서 ..개인적으로 별로였네요 근데 빵이 뭔가 퐁신하니 좀 맛있었던 기억
양가형제,,mflove00,2.22.일,한적하고 마을회관을 리모델링한 매장인데 버거도 정말 맛있고 특히 어니언링은 필히 드셔보시길 강력 추천드립니다.
양가형제,,커피좋아하는인간,2.20.금,근처에 왔다가 햄버거 생각나서 왔어요:) 여전히 사람많고 맛있어요
양가형제,,Amberr Kim,2.18.수,독특하니 맛있어요! 직원분들도 친절하시고 설명도 자세해요 주차자리 넉넉해요 ㅎㅎ 양파튀김은 호불호가 갈릴거 같아요!
양가형제,,밥을먹어요,2.18.수,"제주 서부 여행 중 만난 인생 버거집이에요! ✨ 옛 마을회관을 개조한 공간이라 분위기부터 독보적인데, 매장 앞 주차장도 넓어서 초보 운전인 저도 편하게 방문했네요. 🚗 아기 의자도 있어서 가족 단위로 오기에도 참 좋을 것 같아요.  시그니처인 양버거는 육즙이 정말 예술이고, 치즈 풍미 가득한 석버거랑 바삭한 어니언링 조합이 최고예요! 🍔🧅 특히 밀크쉐이크에 어니언링 찍어 먹는 재미가 쏠쏠합니다. 직원분들도 친절하시고 창밖 마을 풍경까지 평화로워서 힐링하고 가요. 제주 수제버거 제대로 즐기고 싶은 분들께 강추합니다! 👍💖"
양가형제,,맛과공간을리뷰,2.16.월,총점 ⭐️ 3.5 / 5 제주도에 오면 꼭 오고 싶었던 양가형제를 방문했습니다. 수제버거도 좋아하는 편이지만 제가 많이 기대했던건 어니언링이였습니다. 저희는 양버거와 새우버거 그리고 어니언링을 주문했습니다. 양버거는 두꺼운 육즙 가득한 패티가 두장에 소스로만 구성되어 있었는데요 그만큼 고기맛이 강하고 맛있었습니다. 새우버거는 패티가 바삭하고 새우의 식감이 통통씹히는 느낌이 좋았습니다. 마지막으로 제가 가장 기대한 어니언링은 큼지막한 양파라 좋았고 바삭한 튀김의 식감까지 지금까지 제가 먹어본 어니언링 중 제일 맛있었습니다👍 그리고 사장님은 처음 메뉴 설명부터 저희가 나갈때 까지 시종일관 손님들에게 굉장히 친절하셨네요😀 전치적으로 살짝 느끼한 감이 있었지만 잘 먹었습니다
저지해장국 저지포차,,아빠백통,4.4.토,음… 유명은 한데… 대춘이 좀더 나은듯 하다
저지해장국 저지포차,,santa huni,3.22.일,"여행을 하다 보면 관광지 근처 식당도 좋지만 이렇게 동네 분위기를 느낄 수 있는 곳이 더 기억에 남기도 하는데, 이번에 방문한 저지해장국 역시 그런 느낌이 들었던 곳이었습니다.  처음 방문하기 전에는 단순히 배를 채우기 위해 들른 식당이었지만, 막상 식사를 하고 나오면서 ‘아, 여기는 진짜 저지리맛집이라고 불릴 만한 곳이구나’ 하는 생각이 자연스럽게 들었습니다."
저지해장국 저지포차,,TrendFi,3.22.일,저지리 지나갍 때 아침식사로 맛이 좋았어요.
저지해장국 저지포차,,배민왕,3.3.화,"해장국 11. 내장탕 12. 주문했어요~ 해장국은 선지와 고기가 들어있고 내장탕은 칼칼합니다 ㅎ 잡내가 안나고 한끼 식사 든든하게 먹었네요 ㅎㅎ 밥리필 가능 셀프코너에 계란, 젓갈, 고추 등 가져다 드세요~"
저지해장국 저지포차,,은샘447,2.10.화,낮에는 해장국집 저녁에는 포차를 즐길 수 있는 곳이네요. 제주도에서 해장국을 즐길 수 있어요.
저지해장국 저지포차,,내돈내산 팩폭러,1.31.토,해장국과 내장탕 맛있게 잘 먹었습니다. 처음 가져다주시는 반찬만 예쁘게 담아 주시면 참 좋을 것 같다는 생각이 들더라구요. 올레길 가시게 되면 방문하면 좋을 것 같아요.
저지해장국 저지포차,,qwert5981,1.27.화,뭐 먹을지 고민하다가 남편이랑 해장국이랑 내장탕 시켜먹었어요! 저는 해장국이 더 맛있는데 남편은 내장탕이 더 맛나다네요 ㅎㅎㅎ 둘 다 맛있는걸로! 다 먹고 냉커피로 마무리까지하면 해장뚝딱👍
저지해장국 저지포차,,그루언닝,1.10.토,제주도 도민 맛집으로 유명해서 여행차 들렸는데요! 깔끔한 도가니탕과 굴해장국에 굴이 큼직하게 들어가 있어서 너무 맛있게 잘 먹었어요😋 계란 넣어서 단백함이 크고 추가반찬도 셀프코너도 깔끔해서 좋았어요 특히 김치와 깍두기 맛집이네요!!! 같이 곁들여 먹는 찬도 좋아서 해장해야 하는 날 생각 날 거 같아요~
유람위드북스,,playamc,3.28.토,"아늑한 분위기에서 책 읽으며 쉬기 좋은 보물 같은 곳입니다. 친절하고 음료, 디저트 맛도 좋아요."
유람위드북스,,탱이039,2.10.화,여행가서 북카페 들려보긴 처음인데 좋았어요~~~
